ID,Region,Category,Title,Description,Source,Link,Proximity_Score
b46f11ce226d47a43895b308e9ed8054,ASIA_PACIFICO,War & Conflict,"Cambodia demands Thailand withdraw troops, a week into border truce","The two countries agreed to a truce on Dec 27, ending three weeks of clashes.",https://www.straitstimes.com/news/asia/rss.xml,https://www.straitstimes.com/asia/se-asia/cambodia-demands-thailand-withdraw-troops-week-into-border-truce,0.0
71c52e7a13ee0e10ae16a646217d384c,ASIA_PACIFICO,War & Conflict,Authoritarian fears loom in Indonesia as new criminal laws take effect,Critics say the new criminal codes accelerate a drift towards authoritarian governance.,https://www.straitstimes.com/news/asia/rss.xml,https://www.straitstimes.com/asia/se-asia/authoritarian-fears-loom-in-indonesia-as-new-criminal-code-takes-effect,0.0
f63913082f64266ad767be55e487802c,ASIA_PACIFICO,War & Conflict,NCC cadets assisted authorities during Operation Sindoor: Lt. Gen. Virendra Vats,"During the India-Pak. conflict, 75,000 cadets helped the administration, provided medical assistance and arranged voluntary blood donation, says NCC chief",https://www.thehindu.com/news/national/feeder/default.rss,https://www.thehindu.com/news/national/ncc-cadets-assisted-authorities-during-operation-sindoor-lt-gen-virendra-vats/article70468254.ece,0.0
cd786588b36469c9a1e5f9882743d4a8,ASIA_PACIFICO,War & Conflict,"Centre pushes States to speed up farm scheme spending, warns of fund delays",Agriculture Minister Shivraj Singh Chouhan said States must ensure funds earmarked for various schemes are spent before March to avoid administrative bottlenecks that delay the effective implementation of programmes,https://www.thehindu.com/news/national/feeder/default.rss,https://www.thehindu.com/news/national/centre-pushes-states-to-speed-up-farm-scheme-spending-warns-of-fund-delays/article70468211.ece,0.0
296fb7743fbd3677aa827aad990190d8,ASIA_PACIFICO,War & Conflict,Left parties condemn U.S. “aggression” in Venezuela,"The CPI, CPI(M) and the All India Forward Bloc all condemned the U.S. strikes on the Latin American country and the capture of President Nicolás Maduro",https://www.thehindu.com/news/national/feeder/default.rss,https://www.thehindu.com/news/national/left-parties-condemn-us-aggression-in-venezuela/article70468769.ece,0.0
3db9424a44ff3f9f2575e134e4a5a219,ASIA_PACIFICO,War & Conflict,"Chief Minister M.K. Stalin presents awards to weavers and designers, launches temple projects",,https://www.thehindu.com/news/national/feeder/default.rss,https://www.thehindu.com/news/national/tamil-nadu/chief-minister-mk-stalin-presents-awards-to-weavers-and-designers-launches-temple-projects/article70467594.ece,0.0
d6df5ca4c9f387efbb2f34bb82694f67,ASIA_PACIFICO,War & Conflict,Barber held for playing 'anti-national' songs at his shop in Palghar district,"According to locals who complained to the police, he allegedly played provocative content regularly, ignoring previous warnings, an official said",https://www.thehindu.com/news/national/feeder/default.rss,https://www.thehindu.com/news/national/maharashtra/barber-held-for-playing-anti-national-songs-at-his-shop-in-palghar-district/article70468240.ece,0.0
17c83aaf0ebf1b834b831437048bdc36,ASIA_PACIFICO,War & Conflict,CM accuses KCR of Kaleshwaram type exploitation in PRLIS too,Revanth Reddy vows to draw water from Jurala for the project in case clearances are not given to PRLIS with Srisailam as source,https://www.thehindu.com/news/national/feeder/default.rss,https://www.thehindu.com/news/national/telangana/cm-accuses-kcr-of-kaleshwaram-type-exploitation-in-prlis-too/article70468668.ece,0.0
20d85c2f16c47b76d961f7fa1217fe47,ASIA_PACIFICO,War & Conflict,"South Korea's Lee lands in China, hoping to sidestep Taiwan tensions",Lee is the first South Korean leader to visit Beijing in six years and his four-day trip comes less than a week after China carried out massive military drills around Taiwan.,https://www.japantimes.co.jp/feed/,https://www.japantimes.co.jp/news/2026/01/04/asia-pacific/politics/south-koreas-lee-travels-to-china/,0.0
e3b00f6b1c306e122ff45bf1b863788a,ASIA_PACIFICO,War & Conflict,Takaichi avoids criticizing U.S. removal of Venezuela's Maduro,"Some Japanese officials, including ex-defense chief Itsunori Onodera, voiced concern over the U.S. toppling of President Nicolas Maduro — and the precedent it could set for China.",https://www.japantimes.co.jp/feed/,https://www.japantimes.co.jp/news/2026/01/04/japan/politics/japan-us-venezuela-international-law/,0.0
56f69eb6bcd1ba11d69ac231f856601a,ASIA_PACIFICO,War & Conflict,North Korea launches multiple missiles in first tests of 2026,"Tokyo said the missiles flew on ""irregular trajectories,"" traveling 900 and 950 km, respectively — a distance that puts a large section of southern Japan within striking distance.",https://www.japantimes.co.jp/feed/,https://www.japantimes.co.jp/news/2026/01/04/japan/north-korea-missile-first-2026-japan/,0.0
cc42ad875c3da1187b3c4e1ed158f76c,ASIA_PACIFICO,War & Conflict,Trump's bet on regime change in Venezuela is a sharp departure from MAGA agenda,"Since his second inauguration, Trump has bombed targets in Syria, Iraq, Iran, Nigeria, Yemen and Somalia, blown up alleged drug boats and threatened to invade Greenland and Panama.",https://www.japantimes.co.jp/feed/,https://www.japantimes.co.jp/news/2026/01/04/world/politics/trump-venezuela-maga-agenda/,0.0
5fb946c9a2e811d01c513fc838acf37a,ASIA_PACIFICO,War & Conflict,"With a focus on nuclear power, Takaichi’s energy policy takes shape","As she settles into the nation’s top office, Prime Minister Sanae Takaichi’s energy policy is quickly coming into focus and nuclear power stands at the forefront.",https://www.japantimes.co.jp/feed/,https://www.japantimes.co.jp/environment/2026/01/04/energy/takaichi-energy-policy/,0.0
a8f94dc15a88b3d857e2daf66be7f7ef,ASIA_PACIFICO,War & Conflict,"Iran's Khamenei says protesters' economic demands fair, warns 'rioters'","The protests began last Sunday as an expression of discontent over high prices and economic stagnation, but have since expanded to include political demands.",https://www.japantimes.co.jp/feed/,https://www.japantimes.co.jp/news/2026/01/04/world/iran-khamenei-protests-warning/,0.0
bb5d68539cb7c747c455e58c56e8c5e9,ASIA_PACIFICO,War & Conflict,"Singapore 'gravely concerned' about US intervention in Venezuela, urges restraint","Singapore has consistently opposed actions contrary to international law by any parties, including foreign military intervention in any country, said the Ministry of Foreign Affairs.",https://www.channelnewsasia.com/api/v1/rss-outbound-feed?_format=xml,https://www.channelnewsasia.com/singapore/singapore-gravely-concerned-us-intervention-venezuela-5788671,0.0
df5471aca7ee91f666b304c26e323794,ASIA_PACIFICO,War & Conflict,"South Korean president lands in China, hoping to sidestep Taiwan tensions","Lee&nbsp;Jae Myung is the first South Korean leader to visit Beijing in six years and his four-day trip comes less than a week after China carried out massive military drills around Taiwan, the self-ruled island it claims as part of its territory.",https://www.channelnewsasia.com/api/v1/rss-outbound-feed?_format=xml,https://www.channelnewsasia.com/east-asia/south-korea-president-lee-jae-myung-lands-in-china-sidestep-taiwan-tensions-xi-jinping-5788521,0.0
dd8daa35c7320aa3be536f3aa6e187ab,ASIA_PACIFICO,War & Conflict,North Korea fires ballistic missiles towards sea off its east coast,"It comes as South Korean President Lee Jae Myung will make a state visit to China starting on Sunday (Oct 4), where Seoul has said peace on the Korean peninsula would be discussed.",https://www.channelnewsasia.com/api/v1/rss-outbound-feed?_format=xml,https://www.channelnewsasia.com/east-asia/north-korea-fires-ballistic-missiles-towards-sea-its-east-coast-5788381,0.0
e52a3be131aacedb59ff3f2d082b61af,ASIA_PACIFICO,War & Conflict,Was the US capture of Venezuela's president legal?,"Maduro has been&nbsp;charged with crimes related to terrorism, drugs and weapons.",https://www.channelnewsasia.com/api/v1/rss-outbound-feed?_format=xml,https://www.channelnewsasia.com/world/us-capture-venezuela-president-maduro-legal-explainer-5788306,0.0
f121f56893344f031aac2ed0851d77d1,ASIA_PACIFICO,War & Conflict,"New Japan PM to face 'big test' as US president arrives for first visit in six years; defense, trade could be thorny issues: expert",,https://www.globaltimes.cn/rss/outbrain.xml,https://www.globaltimes.cn/page/202510/1346681.shtml,0.0
1a1077f58eb2499b7572c53db5153aa9,ASIA_PACIFICO,War & Conflict,"Jilin-1 releases high-resolution satellite images of Taiwan island, showcasing mainland's tech capacities and warning 'Taiwan independence' separatists: expert",,https://www.globaltimes.cn/rss/outbrain.xml,https://www.globaltimes.cn/page/202510/1346654.shtml,0.0
dff331839c5ace085fc2ba57dda93883,ASIA_PACIFICO,War & Conflict,Gaza ceasefire talks underway amid high international attention,,https://www.globaltimes.cn/rss/outbrain.xml,https://www.globaltimes.cn/page/202510/1345172.shtml,0.0
ff7c1d51e29b530235ee2ab37f010bde,ASIA_PACIFICO,War & Conflict,US amphibious warship catches fire off Okinawa; conflicting reports between US and Japan draw attention,,https://www.globaltimes.cn/rss/outbrain.xml,https://www.globaltimes.cn/page/202508/1341402.shtml,0.0
3a0b5559e3f91404e92f0242298ece29,ASIA_PACIFICO,War & Conflict,Guardians of Memory: Over 30 trips to Japan in 27 years to gather evidence and seek testimonies: An exclusive interview with Unit 731 military crime exhibition hall director,,https://www.globaltimes.cn/rss/outbrain.xml,https://www.globaltimes.cn/page/202508/1340637.shtml,0.0
dcd69abadf64dac09fa3c9001eb7d114,AFRICA,War & Conflict,Africa: African Union Calls for  Inclusive Political Dialogue And Respect for Venezuela's Sovereignty,"[African Union] The African Union is following with grave concern the recent developments in the Bolivarian Republic of Venezuela, including reports of the abduction of the President of the Republic, Mr. Nicol&#xe1;s Maduro, and military attacks on Venezuelan institutions.",https://allafrica.com/tools/headlines/rdf/latest/headlines.rdf,https://allafrica.com/stories/202601040012.html,0.0
0c56d55f251caa0f882356ff46cfcd11,AFRICA,War & Conflict,Somalia: Somalia Says US-Backed Operations Kill Key Al-Shabaab Leaders,"[Shabelle] Mogadishu -- Somalia's defence minister said Saturday that security forces, backed by international partners, have killed two senior Al-Shabaab leaders in a carefully planned air strike, dealing what he described as a major blow to the militant group's leadership.",https://allafrica.com/tools/headlines/rdf/latest/headlines.rdf,https://allafrica.com/stories/202601040011.html,0.0
bbc55aa88665e98c06de2ff83789c34c,AFRICA,War & Conflict,"Ethiopia: Gambella in Turmoil Amid Hunger, Influx of Refugees From Neighboring Sudan, South Sudan",[Reporter] A humanitarian catastrophe is set to unfold in the southern region of Gambella as the federal government deploys troops to help subdue intense violence and unrest that residents and aid workers in the area say stems from rapidly deteriorating living conditions.,https://allafrica.com/tools/headlines/rdf/latest/headlines.rdf,https://allafrica.com/stories/202601030139.html,0.0
bc6fa027896b3343b296b769e8ec609c,AFRICA,War & Conflict,Angola: When Politics Becomes a Crime in Angola,[Maka] Luanda -- Angola's prosecutors allege a Russian-backed plot to overthrow the government. What the indictment offers instead is a case study in how dissent can be rebranded as subversion.,https://allafrica.com/tools/headlines/rdf/latest/headlines.rdf,https://allafrica.com/stories/202601030138.html,0.0
758bbf75b03eb9854232760b2a7e1c36,AFRICA,War & Conflict,Nigeria: Air Force Intensifies Airstrikes in Northern Nigeria,[Premium Times] Post-strike assessments by the Nigerian Air Force confirmed the neutralisation of several terrorists and the elimination of assorted weapons.,https://allafrica.com/tools/headlines/rdf/latest/headlines.rdf,https://allafrica.com/stories/202601030110.html,0.0
3e9ec5511619dc7dab62f4d4f49c6959,AFRICA,War & Conflict,"Nigeria: Again, Gunmen Invade Plateau Village, Kill Seven, Injure Others","[This Day] Jose -- Gunmen attacked a village in Plateau State's Qua'an-Pan Local Government Area (LGA), killing seven people and injuring several others on Friday night.",https://allafrica.com/tools/headlines/rdf/latest/headlines.rdf,https://allafrica.com/stories/202601040015.html,0.0
cc86be8bb05c88fde8c9a043d3f86f70,AFRICA,War & Conflict,"Nigeria: Trump May Go After Terror Sympathisers, Financiers in Nigeria","[Leadership] The United States (US) Christmas Day bombing of ISIS-linked terrorist camps in Sokoto State has opened a vista of complicated issues and a deepening world -wide intervention that will likely employ extreme measures against the terrorists' sympathisers, financiers, ideologues and enablers in Nigeria.",https://allafrica.com/tools/headlines/rdf/latest/headlines.rdf,https://allafrica.com/stories/202601040005.html,0.0
3393879c91f9140e4fef085e62b98406,AFRICA,War & Conflict,"Africa: Drug-Resistant Infections Rising Across Africa, Study Warns","[Premium Times] The African health organisation said that the study analysed more than 187,000 laboratory test results from 205 laboratories in 14 African countries, including Nigeria.",https://allafrica.com/tools/headlines/rdf/latest/headlines.rdf,https://allafrica.com/stories/202601040018.html,0.0
dbf1cf945f03ac96b59f78a785a24d35,AFRICA,War & Conflict,East Africa: Inside Israel's Foray Into the Horn of Africa,"[Independent (Kampala)] When Israel announced on Dec.26 that it had formally recognised Somaliland as an independent and sovereign state, it triggered diplomatic shockwaves far beyond the arid plains of northern Somalia.",https://allafrica.com/tools/headlines/rdf/latest/headlines.rdf,https://allafrica.com/stories/202601040003.html,0.0
06b05c0954eced38a97a301d46e0ee01,AFRICA,War & Conflict,Nigeria: Resident Doctors to Resume Strike January 12,"[Vanguard] Abuja -- The Nigerian Association of Resident Doctors (NARD) has announced plans to resume its Total Industrial and Clinical Services (TICS) 2.0 nationwide from January 12, 2026, following the outcome of its Emergency National Executive Council (E-NEC) meeting held on January 2, 2026.",https://allafrica.com/tools/headlines/rdf/latest/headlines.rdf,https://allafrica.com/stories/202601030123.html,0.0
db0f59b6a453e39525fc3409f9f7c033,AFRICA,War & Conflict,"Africa: AU Urges Inclusive Political Dialogue in Venezuela, Warns Us Move Destabilizing","[Capital FM] Nairobi -- The African Union (AU) has expressed deep concern over the escalating crisis in Venezuela, warning that the country's complex internal challenges can only be resolved through inclusive political dialogue among Venezuelans themselves.",https://allafrica.com/tools/headlines/rdf/latest/headlines.rdf,https://allafrica.com/stories/202601040019.html,0.0
1fede950c236723fd3626c030ad65cd6,AFRICA,War & Conflict,Ghana: Ghana Negotiating Release of Ghanaian Prisoner of War in Ukraine,[Ghanaian Times] Ghana has commenced diplomatic negotiations with Ukraine to secure the release of a Ghanaian national (name withheld) who is being held by the Ukrainians as a prisoner of war.,https://allafrica.com/tools/headlines/rdf/latest/headlines.rdf,https://allafrica.com/stories/202601040013.html,0.0
08a3fb5db979363af5ca91d21819dee3,AFRICA,War & Conflict,"Nigeria: Nigerian Army Uncovers Suicide Bombing Network, Identifies Key Coordinator","[Premium Times] The Army says its investigations established the structure, roles and operational linkages of the suicide bombing terror cell.",https://allafrica.com/tools/headlines/rdf/latest/headlines.rdf,https://allafrica.com/stories/202601040006.html,0.0
159d0a4b374118cf0b3d3397321b2587,NORTEAMERICA,Politics & Policy,GOP prepared to block vote to replace Feinstein on Senate Judiciary,"Senate Majority Leader Chuck Schumer said on Tuesday that he hopes to replace Democratic Sen. Dianne Feinstein on the Senate Judiciary Committee with Sen. Ben Cardin of Maryland and aims to set up a floor vote on the issue this afternoon, which Republicans are expected to block.",http://rss.cnn.com/rss/cnn_topstories.rss,https://www.cnn.com/2023/04/18/politics/schumer-senate-feinstein-vote-cardin/index.html,73.78
6150ab845a70938b93c030a48dee7d24,NORTEAMERICA,Politics & Policy,Recap: 'Succession' finds dark humor in the aftershocks,"After the shock came the aftershocks, the power vacuum, and perhaps most significantly and impressively, the laughs, as ""Succession"" pivoted to face life after Logan Roy, in an episode that finally put the HBO show's title into full flower.",http://rss.cnn.com/rss/cnn_topstories.rss,https://www.cnn.com/2023/04/16/entertainment/succession-season-4-episode-4-recap/index.html,73.89
d4f6dc8d6db65628f008f3d26da1907b,NORTEAMERICA,Politics & Policy,Maduro arrives in New York. What to know about the U.S. operation in Venezuela,"President Trump said the U.S. would ""run"" Venezuela, following the capture of President Nicolás Maduro on Saturday. But many questions remain about what's next.",https://feeds.npr.org/1001/rss.xml,https://www.npr.org/2026/01/03/nx-s1-5665670/venezuela-strikes-us-maduro,88.75
0572071b6d61a4ac518352701dc2b8fa,NORTEAMERICA,Politics & Policy,How Democrats Are Hitting Trump Over Nicolás Maduro’s Ouster,Some of the nation’s most influential Democrats condemned the move as unjustified and argued that the president was trying to distract from his domestic challenges.,https://rss.nytimes.com/services/xml/rss/nyt/World.xml,https://www.nytimes.com/live/2026/01/03/world/trump-united-states-strikes-venezuela/democrats-trump-venezuela-maduro,86.01
3834e285989fffb003437ad81fb70a77,NORTEAMERICA,Politics & Policy,Venezuela’s Interim Leader Defies Trump and Calls Maduro the ‘Only President’,"President Trump said that Venezuela’s new leader, Delcy Rodríguez, would help the United States run Venezuela. She quickly said the opposite.",https://rss.nytimes.com/services/xml/rss/nyt/World.xml,https://www.nytimes.com/2026/01/03/world/americas/delcy-rodriguez-maduro-only-president.html,88.07
a18e92e5e3d61895f49786099e15f6ca,NORTEAMERICA,Politics & Policy,"Inside ‘Operation Absolute Resolve,’ the U.S. Effort to Capture Maduro","The tactically precise operation successfully extracted Mr. Maduro with no loss of American life, a result heralded by President Trump amid larger questions about the legality and rationale for the U.S. actions in Venezuela.",https://rss.nytimes.com/services/xml/rss/nyt/World.xml,https://www.nytimes.com/2026/01/03/us/politics/trump-capture-maduro-venezuela.html,88.05
2d8223a3344d97a3d24092711e57b0c5,NORTEAMERICA,Politics & Policy,Vance Justifies Capture as Bringing Maduro to Justice,"Mr. Maduro has “multiple indictments in the United States for narcoterrorism,” the vice president said.",https://rss.nytimes.com/services/xml/rss/nyt/World.xml,https://www.nytimes.com/2026/01/03/world/americas/jd-vance-nicolas-maduro-venezuela.html,86.45
70ccc95af5d1da3647c394a2dd425a63,NORTEAMERICA,Politics & Policy,"Trump Avoids Congressional Approval for Maduro’s Capture, and Democrats Raise Alarms","Democrats raised constitutional concerns and said the Trump administration had misrepresented its goals in Venezuela, while most Republicans cheered the action.",https://rss.nytimes.com/services/xml/rss/nyt/World.xml,https://www.nytimes.com/2026/01/03/us/politics/trump-venezuela-congress-authorization.html,87.77
9e6de7c68dd126067e555d2dae7434b6,NORTEAMERICA,Politics & Policy,Maduro and His Wife Face a Fresh Indictment in Manhattan,The Venezuela president was first charged in 2020 with narco-terrorism and other crimes. The indictment unsealed Saturday says he worked with traffickers to send cocaine from Venezuela to the United States.,https://rss.nytimes.com/services/xml/rss/nyt/World.xml,https://www.nytimes.com/2026/01/03/world/americas/pam-bondi-maduro-indictment.html,86.67
f33a8b544550f3a49561d36670a8d26e,NORTEAMERICA,Politics & Policy,"Live updates: Trump operation against Maduro draws praise, fury","President Trump&#8217;s operation to oust Venezuelan President Nicolás Maduro on Saturday drew a sharp response in the U.S. and abroad, from outright praise to fury, with some expressing gladness over the end of a dictator&#8217;s regime tempered by concern over how it was handled. The massive covert operation, in the works since late summer, followed&#8230;",https://thehill.com/feed/,https://thehill.com/homenews/administration/5671431-live-updates-trump-venezuela-maduro/,89.69
2b9bc93894b2bc2e2f45ecd1202e9757,NORTEAMERICA,Politics & Policy,Five key takeaways on Trump’s stunning toppling of Maduro,"President Trump sent shockwaves throughout the world&#160;when the U.S. successfully carried out an operation to&#160;capture&#160;Venezuelan President Nicolás Maduro.&#160;&#160; The large scale operation took place in the early hours of Saturday and involved more than 150 U.S. aircraft. Maduro and his wife, Cilia Flores, were swiftly charged in the Southern District of New York and are en route&#8230;",https://thehill.com/feed/,https://thehill.com/homenews/administration/5671319-trump-venezuela-operation-maduro-takeaways/,89.56
49f106dbd39e7bb6dd6cc95117305f8e,NORTEAMERICA,Politics & Policy,Trump administration informed Gang of Eight of Venezuela operation after it started,"The Trump administration informed the “Gang of Eight,” the top Republican and Democratic leaders of the Senate and House and the chairmen and ranking members of the Senate and House Intelligence Committees, of the operation against Venezuelan President Nicolás Maduro only after it started, according to a source familiar with the matter. The administration didn’t&#8230;",https://thehill.com/feed/,https://thehill.com/homenews/senate/5671149-surprise-operation-maduro-arrest/,86.22
1e0caf93e0626a64d6f05bf3b45d1e8c,NORTEAMERICA,Politics & Policy,Cotton defends lack of congressional notification for Maduro operation,"Sen. Tom Cotton (R-Ark.) on Saturday said the Trump administration did not notify congressional leaders ahead of its operation to arrest and remove Venezuelan leader Nicolas Maduro even as he defended the decision. “That’s probably one reason it didn’t leak over these four days as they were waiting for the right weather,” Cotton, the chair&#8230;",https://thehill.com/feed/,https://thehill.com/homenews/senate/5670962-cotton-trump-congress-notification-maduro-operation/,86.24
1921c9637d218c3e38c667a5883d68f1,NORTEAMERICA,Politics & Policy,READ: Justice Department’s 2020 indictment against Maduro,"Attorney General Pam Bondi on Saturday morning said Venezuelan President Nicolás Maduro, along with his wife Cilia Flores, had been indicted in the Southern District of New York. He &#8220;has been charged with Narco-Terrorism Conspiracy, Cocaine Importation Conspiracy, Possession of Machineguns and Destructive Devices, and Conspiracy to Possess Machineguns and Destructive Devices against the United&#8230;",https://thehill.com/feed/,https://thehill.com/regulation/court-battles/5670864-nicolas-maduro-narco-terrorism-charges-read/,88.65
4fe15c0928b19691e6fe8d7925810d93,NORTEAMERICA,Politics & Policy,Trump tries to beat back questions about health: Key takeaways,"In one of his most candid interviews about his age, President Trump disclosed the ways he manages his health, several of which go against the advice of his doctors.  Speaking to The Wall Street Journal in an interview published Thursday, Trump discussed his discomfort with some of the guidance coming from his physicians, as well as his regrets over&#8230;",https://thehill.com/feed/,https://thehill.com/homenews/administration/5670319-trump-health-age-aspirin-takeaways/,76.14
0017a70bddadb0551f5fc6857109d370,NORTEAMERICA,Politics & Policy,Trump’s feud with Colorado over Tina Peters intensifies while drawing in Boebert,"President Trump is in a full-fledged feud with politicians in the state of Colorado that is both intensifying and increasingly bringing in other Republicans annoyed with steps taken by the White House. The root of the issue appears to be the prosecution of former Mesa County elections clerk Tina Peters, who has aligned herself with&#8230;",https://thehill.com/feed/,https://thehill.com/homenews/administration/5670311-trump-pardon-tina-peters/,77.4
0622530dbcfc234e11a9ddf9ac50a989,NORTEAMERICA,Politics & Policy,Minnesota fraud scandal poses danger for Democrats in Senate race,"The massive statewide fraud scandal in Minnesota&#160;is threatening to become a liability for&#160;Democrats in the state’s closely watched Senate race this year.&#160; In particular, some Democrats think the widespread money laundering scheme, which is estimated to have stolen as much as roughly&#160;$9 billion, could be a problem for Lt. Gov. Peggy Flanagan, the second-in-command to&#8230;",https://thehill.com/feed/,https://thehill.com/homenews/campaign/5670354-minnesota-democrats-fraud-scandal/,74.87
18c3fdd36aaafdf964bc9aa0cead2100,NORTEAMERICA,Politics & Policy,"Curtis Sliwa defends Mamdani, chalks up Trump ‘love-fest’ to them both being ‘actors’","Former New York City mayoral candidate Curtis Sliwa (R) defended Mayor Zohran Mamdani (D) ahead of his swearing-in, but described the recent meeting between him and President Trump as them being &#8220;actors&#8221; in a &#8220;love-fest.&#8221; Sliwa spoke for an interview with The Wall Street Journal on Monday. When asked if he would have other New&#8230;",https://thehill.com/feed/,https://thehill.com/homenews/state-watch/5670588-curtis-sliwa-defends-mayor-mamdani/,79.83
