ID,Region,Category,Title,Description,Source,Link,Proximity_Score
93c0cd10d43429d524b8e7c3ea5af56b,ASIA_PACIFICO,Politics & Policy,"Bengal polls: Will increase tea garden workers’ daily wages to ₹300 after we form govt., says TMC MP Abhishek Banerjee",TMC MP said he will raise the issue of creches and PHCs in Kolkata in front of senior party leaders and CM Mamata Banerjee,https://www.thehindu.com/news/national/feeder/default.rss,https://www.thehindu.com/news/national/west-bengal/bengal-polls-will-increase-tea-garden-workers-daily-wages-to-300after-we-form-govt-says-tmc-mp-abhishekbanerjee/article70468018.ece,68.13
b2f9bfb8fde97e4d8c975652f4ee7d74,ASIA_PACIFICO,Politics & Policy,National Education Policy will bring country's new generation out of Macaulay mentality: Pradhan,"The NEP, announced on July 29, 2020, proposes various reforms in school education as well as higher and technical education",https://www.thehindu.com/news/national/feeder/default.rss,https://www.thehindu.com/news/national/national-education-policy-will-bring-countrys-new-generation-out-of-macaulay-mentality-pradhan/article70468719.ece,72.13
3342f031873512868fec4908e9972de8,ASIA_PACIFICO,Politics & Policy,Trump snatches Maduro but leaves his regime in charge for now,"Hours after President Donald Trump stunned the world by saying the U.S. plans to ""run” Venezuela, uncertainty over what that means and who is in charge loomed.",https://www.japantimes.co.jp/feed/,https://www.japantimes.co.jp/news/2026/01/04/world/politics/trump-us-run-venezuela/,87.96
9b9ad55cad2b69b4f418daa48a64ce37,ASIA_PACIFICO,Politics & Policy,Trump is tying his legacy to whatever happens in Venezuela,The intervention probably also violates domestic U.S. law. It comes well after — if one starts the clock on Sept. 2 — when the U.S. struck the first boat in the Caribbean.,https://www.japantimes.co.jp/feed/,https://www.japantimes.co.jp/commentary/2026/01/04/world/venezuela-will-define-trump-legacy/,86.34
a07432f8360487821be2f95d5dd7a005,ASIA_PACIFICO,Politics & Policy,"Democratic US lawmakers say they were misled on Venezuela, demand a plan","""Congress does have a tendency to leak,"" Trump told reporters.",https://www.channelnewsasia.com/api/v1/rss-outbound-feed?_format=xml,https://www.channelnewsasia.com/world/us-venezuela-capture-maduro-democratic-lawmakers-demand-5788226,84.47
0069a5be4c3b76f89ae8a99c6c8b7720,ASIA_PACIFICO,Politics & Policy,"Japan's new PM delivers first policy address, showing 'shift from earlier hardline rhetoric against China'",,https://www.globaltimes.cn/rss/outbrain.xml,https://www.globaltimes.cn/page/202510/1346478.shtml,74.55
a3cf59631fae26f6d4fe5bd9353ef28a,ASIA_PACIFICO,Politics & Policy,"Japan's LDP, JIP agree to form coalition government, Takaichi's election as Japan's first female PM virtually assured: media",,https://www.globaltimes.cn/rss/outbrain.xml,https://www.globaltimes.cn/page/202510/1346026.shtml,73.9
fe45919359f06282207d4e8ebdbc142a,AFRICA,Politics & Policy,Government suspends Gabon team and bans Aubameyang,"Gabon's sports minister announces a series of punishments after the national team's ""disgraceful performance"" at the Africa Cup of Nations.",http://feeds.bbci.co.uk/news/world/africa/rss.xml,https://www.bbc.com/sport/football/articles/cn56z2ye7nro?at_medium=RSS&at_campaign=rss,74.2
5e5cc3cc9baaaad13ae041245f14b8f8,AFRICA,Politics & Policy,"Coups, elections and protests - a difficult year for democracy in Africa",Post-election violence in Tanzania and more coups were part of a turbulent 12 months on the continent.,http://feeds.bbci.co.uk/news/world/africa/rss.xml,https://www.bbc.com/news/articles/c1lr70jg2zgo?at_medium=RSS&at_campaign=rss,76.65
67c5cee59294a10495a8403c05c75c5a,AFRICA,Politics & Policy,"One general, one mathematician: The men competing for power in two African elections",The leaders of Guinea and the Central African Republic aim to consolidate power after Sunday's polls.,http://feeds.bbci.co.uk/news/world/africa/rss.xml,https://www.bbc.com/news/articles/cpwk9grv290o?at_medium=RSS&at_campaign=rss,76.46
46d73a9852a4fc0d6719148a0980feca,AFRICA,Politics & Policy,Uganda: Political Policing in Museveni's Uganda - What It Means for the 2026 Elections,[The Conversation Africa] Uganda's police have long faced criticism for politically charged interventions. These include episodes in which lethal force has been used in ways that observers describe as excessive or indiscriminate. The main targets of restrictive or coercive tactics are supporters of the political opposition.,https://allafrica.com/tools/headlines/rdf/latest/headlines.rdf,https://allafrica.com/stories/202601040020.html,77.61
3c0e6899b562fada3d5cc8ed41f72210,AFRICA,Politics & Policy,"Nigeria: 25 Dead, 14 Missing After Boat Capsizes","[Vanguard] No fewer than 25 persons died while 14 others are still missing after a boat capsized along the Yobe River in Garbi town, Nguru Local Government Area of the state.",https://allafrica.com/tools/headlines/rdf/latest/headlines.rdf,https://allafrica.com/stories/202601040010.html,74.41
e632c38a5e0eafd6a6c7400472bf57cb,AFRICA,Politics & Policy,Nigeria: Exclusive - Islamic Cleric Detained Over Alleged Link to Coup Plot Against President Tinubu,[Premium Times] This is despite denial by the Nigerian government that there was no plan to topple Mr Tinubu's government.,https://allafrica.com/tools/headlines/rdf/latest/headlines.rdf,https://allafrica.com/stories/202601040004.html,79.55
05862a1a542e51d2d338d64b88de41e5,AFRICA,Politics & Policy,Africa: HIV Funding Still Falls Short of Targets After Pledges - What's At Stake,[The Conversation Africa] The US government paused all foreign assistance in January 2025. This abrupt decision affected the delivery of life-saving HIV medicines and the provision of HIV prevention services to millions of people. A UNAIDS report estimates there could be an additional 6 million new HIV infections and 4 million Aids-related deaths by 2029 if the world does not act.,https://allafrica.com/tools/headlines/rdf/latest/headlines.rdf,https://allafrica.com/stories/202601040021.html,76.31
a37e1f7fa79909cea093bd4bc3a21c4c,AFRICA,Politics & Policy,Liberia: Liberia Returns to the UN Security Council After 64 Years,"[Liberian Observer] Sixty-four years after it last sat at the world's most powerful peace and security table, Liberia on Friday formally reclaimed its place on the United Nations Security Council (UNSC), marking a watershed moment in the country's diplomatic history and underscoring what many observers describe as the single most significant foreign policy achievement of the Boakai administration so far.",https://allafrica.com/tools/headlines/rdf/latest/headlines.rdf,https://allafrica.com/stories/202601040014.html,78.62
0905f2a8b4965a9d7c746c0cca608ddb,AFRICA,Politics & Policy,"Nigeria: Police Nab 928 Suspects for Kidnapping, Child Trafficking in Imo","[Leadership] The Imo State Police Command has revealed that 928 suspects were arrested for various offences including kidnapping, armed robbery, cultism and child trafficking last year.",https://allafrica.com/tools/headlines/rdf/latest/headlines.rdf,https://allafrica.com/stories/202601030126.html,74.99
121cf2e78ac7ac692caf79a9d45fdbf4,AFRICA,Politics & Policy,Somalia: President Condemns Trump Remarks On Somalis As 'Trash',"[Shabelle] Mogadishu -- Somali President Hassan Sheikh Mohamud has strongly condemned remarks attributed to US President Donald Trump in which he reportedly referred to Somalis as ""trash,"" calling the comments unacceptable and an insult to the dignity of an entire nation.",https://allafrica.com/tools/headlines/rdf/latest/headlines.rdf,https://allafrica.com/stories/202601030111.html,77.48
20cc06a88e9752c15e9a86e0117d60fa,NORTEAMERICA,Social & Rights,Seahawks secure top seed in NFC with dominant road win over 49ers,The Seattle Seahawks beat the San Francisco 49ers for a franchise-record 14th win and the NFC playoffs top seed after quarterback Brock Purdy&apos;s fourth-quarter interception.,http://feeds.foxnews.com/foxnews/latest,https://www.foxnews.com/sports/seahawks-defeat-49ers-secure-top-seed-nfc,74.4
b823a7419fd4194e5a6696f85c4ac3b6,NORTEAMERICA,Social & Rights,Barry Manilow gives fans positive health update following his recent cancer diagnosis,Music legend Barry Manilow is reportedly recovering well from lung cancer surgery. The 82-year-old&apos;s positive hospital update follows his December diagnosis.,http://feeds.foxnews.com/foxnews/latest,https://www.foxnews.com/entertainment/barry-manilow-gives-fans-positive-health-update-following-his-recent-cancer-diagnosis,73.94
7cc95ea83e4568349e4e65e4cb6719c2,NORTEAMERICA,Social & Rights,Trump admin halts Minnesota childcare payments amid fraud investigation,"All child care payments to Minnesota were frozen Tuesday evening as the Trump administration investigates alleged fraud by organizations in the state, Health and Human Services deputy secretary Jim O'Neill announced. Why it matters: The Trump administration has repeatedly portrayed Minnesota as a propagator of fraud, particularly placing blame on the state's large Somali community. The expanded investigation into Minnesota's daycare centers follows allegations from MAGA-aligned YouTuber Nick Shi",https://www.axios.com/feeds/feed.rss,https://www.axios.com/2025/12/31/trump-minnesota-payments-fraud-childcare-walz,75.14
86e0c872356f422a23b0fa91e76f8e01,NORTEAMERICA,Social & Rights,The next big home design features,"Get ready for more at-home wellness perks, nostalgic design nods and eco-friendly upgrades, according to industry pros.Why it matters: These trends indicate what American homes may look like in 2026.State of play: ""Wellness features"" are now being mentioned 33% more often in Zillow listings compared to a year ago, per the real estate site's 2026 Home Trends Report.Mentions of spa-inspired bathrooms are up 22%.Meanwhile, ""traditional"" and Art Deco styles are back — part of a bigger retro revival,",https://www.axios.com/feeds/feed.rss,https://www.axios.com/2025/12/27/trending-home-design-feature-2026,74.24
5a5fedd95030bdab26ff69fa7d619f21,LATINOAMERICA,Social & Rights,Destinarán 2 mil 755 mdp para el saneamiento del río Atoyac,"Puebla, Pue., El gobierno del estado dio a conocer que entre lo ejercido en 2025 y las proyecciones presupuestales para 2026, se destinarán alrededor de 2 mil 755 millones de pesos para las labores de saneamiento del río Atoyac.",https://www.jornada.com.mx/rss/edicion.xml?v=1,https://www.jornada.com.mx/2026/01/04/estados/027n1est?partner=rss,81.77
734a33c55f0d1cb2da85005af6795f3b,LATINOAMERICA,Social & Rights,Un cuarto de siglo de resistencia venezolana al injerencismo de EU,"La actual amenaza militar de Estados Unidos contra Venezuela no es un relámpago en cielo sereno. El país sudamericano lleva 25 años resistiendo las agresiones de la primera potencia económica y militar del planeta. El comandante Hugo Chávez ganó las elecciones presidenciales de diciembre de 1998 al frente de un movimiento de masas inédito en la historia de esa nación, compuesto por multitudes de los barrios más pobres entusiasmadas por la convicción de un líder popular decidido a voltear la tort",https://www.jornada.com.mx/rss/edicion.xml?v=1,https://www.jornada.com.mx/2026/01/04/politica/010n1pol?partner=rss,85.29
6792ede6611fdda9934b9d54826620d9,LATINOAMERICA,Social & Rights,Alia Lira Hartmann: Desde otras ciudades,"Sri Lanka, al sudoeste de India, tiene 65 mil kilómetros cuadrados. Su población es de 21 millones de habitantes y la isla se encontró bajo dominio de Gran Bretaña entre 1815 y 1948, cuando logró su independencia para convertirse en la República Democrática Socialista de Sri Lanka; era conocida en la antigüedad como Ceilán, nombre dado por los británicos.",https://www.jornada.com.mx/rss/edicion.xml?v=1,https://www.jornada.com.mx/2026/01/04/opinion/030o1cap?partner=rss,79.43
299f7a3f93f5a4c9978abf56af3580d9,LATINOAMERICA,Social & Rights,El papa León XIV  pidió garantizar la soberanía y el bienestar de Venezuela tras la captura de Nicolás Maduro,"El pontífice reclamó ""asegurar el Estado de Derecho inscrito en la Constitución, respetar los derechos humanos y civiles de todos y cada uno"".Lo dijo tras su oración del Ángelus en la plaza de San Pedro del Vaticano.",https://www.clarin.com/rss/lo-ultimo/,https://www.clarin.com/mundo/papa-leon-xiv-pidio-garantizar-soberania-bienestar-venezuela-captura-nicolas-maduro_0_9hFbRGlYWb.html,84.28
9bc0017fc712b1eab1f60f9b4186d0c8,LATINOAMERICA,Social & Rights,Fuerza bruta en Venezuela,La intervención militar de Estados Unidos contra el régimen autoritario de Maduro vulnera el derecho internacional; es necesaria una desescalada inmediata para una solución democrática y pacífica,https://feeds.elpais.com/mrss-s/pages/ep/site/elpais.com/section/america/portada,https://elpais.com/opinion/2026-01-03/fuerza-bruta-en-venezuela.html,82.49
f35adb6f0fdc36c7bf4c685f0aa6a8fa,LATINOAMERICA,Social & Rights,Bienvenidos en 2026 a la economía en forma de K: por qué la IA nos hará más productivos (y más desiguales),La inteligencia artificial apuntalará este año un modelo de crecimiento que exacerba las disparidades y aumenta los desequilibrios,https://feeds.elpais.com/mrss-s/pages/ep/site/elpais.com/section/america/portada,https://elpais.com/economia/negocios/2026-01-03/bienvenidos-en-2026-a-la-economia-en-forma-de-k-por-que-la-ia-nos-hara-mas-productivos-y-mas-desiguales.html,82.05
38f894077c54466dedd43fd8d8dc8d9d,LATINOAMERICA,Social & Rights,La IA de Musk crea sin permiso imágenes falsas de chicas en bikini a partir de fotos reales,"El Gobierno francés  denuncia ante la Justicia a Grok, la inteligencia artificial integrada en X, por esta práctica viral",https://feeds.elpais.com/mrss-s/pages/ep/site/elpais.com/section/america/portada,https://elpais.com/tecnologia/2026-01-02/la-ia-de-musk-hace-viral-una-tendencia-con-imagenes-sexistas-de-mujeres.html,80.83
3188435706328aa8190231236a4436d3,LATINOAMERICA,Social & Rights,Nepal: hombre muere después de pasar 329 días en huelga de hambre,Nada Prasad Adhikari de 56 años había dejado de recibir alimentos desde octubre de 2013 para exigir acciones para castigar a los responsables de la muerte de su hijo de 18 años durante la guerra civil nepalí.,https://www.bbc.com/mundo/ultimas_noticias/index.xml,http://www.bbc.co.uk/mundo/ultimas_noticias/2014/09/140922_ultnot_nepal_hombre_huelga_de_hambre_amv.shtml,80.78
cce981ac1cc2222539e7c01a1d5dcaf7,LATINOAMERICA,Social & Rights,"Estable, soleado y sin lluvias: el pronóstico del tiempo para este domingo en todo el país, según el último parte del SMN",El Servicio Meteorológico Nacional anunció que la temperatura oscilará entre los 17° y los 28° C; la nubosidad se mantendrá variable durante todo el día,https://www.lanacion.com.ar/arc/outboundfeeds/rss/,https://www.lanacion.com.ar/sociedad/estable-soleado-y-sin-lluvias-el-pronostico-del-tiempo-para-este-domingo-segun-el-ultimo-parte-del-nid04012026/,81.02
fbca7c177d7e2295667386039f2c6683,LATINOAMERICA,Social & Rights,El sentido homenaje a Eddie Munson en el final de Stranger Things que muchos pasaron por alto,El personaje tuvo uno de los momentos más significativos en la cuarta temporada y fue recordado durante el final de la serie; mirá el video del episodio final,https://www.lanacion.com.ar/arc/outboundfeeds/rss/,https://www.lanacion.com.ar/espectaculos/el-sentido-homenaje-a-eddie-munson-en-el-final-de-stranger-things-que-muchos-pasaron-por-alto-nid03012026/,76.59
a655308c57e8a2883edf83992b763936,LATINOAMERICA,Social & Rights,Racing ya tiene a Valentín Carboni: se definieron las condiciones de su incorporación,El juvenil media-punta viajará en los próximos días tras el acuerdo entre la Academia e Inter de Milán,https://www.lanacion.com.ar/arc/outboundfeeds/rss/,https://www.lanacion.com.ar/deportes/futbol/racing-ya-tiene-a-valentin-carboni-se-definieron-las-condiciones-de-su-incorporacion-nid03012026/,76.97
4549ac0ff898f20e5568969083894d42,LATINOAMERICA,Social & Rights,"Qué es el Cartel de los Soles, la organización narcoterrorista que Washington señala bajo el mando de Nicolás Maduro",El capturado líder chavista es acusado por tráfico de toneladas de cocaína; el rol del Tren de Aragua,https://www.lanacion.com.ar/arc/outboundfeeds/rss/,https://www.lanacion.com.ar/seguridad/que-es-el-cartel-de-los-soles-la-organizacion-narcoterrorista-que-washington-senala-bajo-el-mando-de-nid03012026/,81.9
21c34438880f15cdc901fbdee01da656,LATINOAMERICA,Social & Rights,"Barcelona sufrió en el clásico catalán, pero lo sostuvo el héroe-villano y lo liquidó con dos golazos","Joan García jamás se olvidará del partido que ganó su nuevo equipo ante Espanyol, el que lo vio nacer",https://www.lanacion.com.ar/arc/outboundfeeds/rss/,https://www.lanacion.com.ar/deportes/futbol/barcelona-sufrio-en-el-clasico-catalan-pero-lo-sostuvo-el-heroe-villano-y-lo-liquido-con-dos-golazos-nid03012026/,77.78
1ba6d60ca179dfb68bcfd38261736bbd,LATINOAMERICA,Social & Rights,Un paseo familiar terminó en tragedia en Santa Marta: los hechos que llevaron a la muerte de un niño de 5 años ahogado en playas de Mendihuaca,"En cuestión de segundos, un momento de distracción bastó para que Liam perdiera la vida ahogado en playas de la zona rural de Santa Marta. ¿Qué pasó?",https://www.eltiempo.com/rss/colombia.xml,https://www.eltiempo.com/colombia/otras-ciudades/un-paseo-que-termino-en-tragedia-la-muerte-por-inmersion-de-un-nino-de-5-anos-en-playas-rurales-de-santa-marta-3521590,82.2
e8ba67073149e93b665688e3e39ae50d,EUROPA,Social & Rights,Crans-Montana fire: what we know so far about how it could have started,"Switzerland is reeling from the deadly fire in ski resort Crans-Montana. Some 47 people were killed on New Years eve, more than one hundred people were severely burned. The first emergency is to treat the wounded and identify victims. Authorities are also investigating what caused the fire and whether the bar violated security norms.",https://www.france24.com/en/europe/rss,https://www.france24.com/en/video/20260102-crans-montana-fire-what-we-know-so-far-about-how-it-could-have-started,76.84
54e736c10890ec1576b0055231f0d4f1,EUROPA,Social & Rights,"Bird-flu, nukes and asteroids: what 2026 might have in store",If H5N1 bird flu made the jump to humans it could lead to a pandemic worse than Covid,https://www.telegraph.co.uk/news/rss.xml,https://www.telegraph.co.uk/news/2025/12/31/bird-flu-nukes-and-asteroids-what-2026-might-have-in-store/,76.08
3e788ad0d80617ad79afc3208a3f342d,MEDIO_ORIENTE,Social & Rights,'Locked and loaded': Trump threatens Iran over protester deaths,"'Locked and loaded': Trump threatens Iran over protester deaths

    
    

          
      
      
        Submitted by 
MEE staff
 on 
Fri, 01/02/2026 - 17:13

        
      
    
      
    
                At least seven people were killed amid mass protests in Iran over the cost of living
                      
                  
                  

  


                  People walk past an anti-US mural on a street in Tehran, Iran on 2 January 2026 (Majid Asgaripour/West Asia News Agenc",https://www.middleeasteye.net/rss,https://www.middleeasteye.net/news/locked-and-loaded-trump-threatens-iran-over-protester-deaths,79.66
1712d98b76ed253c4880449221a734ee,ASIA_PACIFICO,Social & Rights,"Mizuho, JPMorgan among SWIFT partners set for instant cross-border payments",,https://asia.nikkei.com/rss/feed/nar,https://asia.nikkei.com/business/finance/mizuho-jpmorgan-among-swift-partners-set-for-instant-cross-border-payments,73.03
b04b34a4c3cb8b1176718c51ac2565e2,ASIA_PACIFICO,Social & Rights,India unveils Buddha gems after century abroad,One of the caskets unearthed with the treasure confirmed the contents as “relics of the Buddha”.,https://www.straitstimes.com/news/asia/rss.xml,https://www.straitstimes.com/asia/south-asia/india-unveils-buddha-gems-after-century-abroad,76.02
cd86420ccea2e1f779eff39b531056d0,ASIA_PACIFICO,Social & Rights,"Promote khadi, encourage indigenous artisans, says Vijayawada MP","It is our responsibility to pass on khadi products as a heritage to the future generations, says Kesineni Sivanath",https://www.thehindu.com/news/national/feeder/default.rss,https://www.thehindu.com/news/national/andhra-pradesh/promote-khadi-encourage-indigenous-artisans-says-vijayawada-mp/article70468508.ece,74.55
46a2c0bb19827daa8feaa487693e9b6b,AFRICA,Social & Rights,Schools to start reopening after Nigeria mass abduction,"Schools in ""safe and secure areas"" will be allowed to reopen after 250 children were taken in November.",http://feeds.bbci.co.uk/news/world/africa/rss.xml,https://www.bbc.com/news/articles/c0lxprn290xo?at_medium=RSS&at_campaign=rss,76.14
10900d7a8875631e65f649651d2b030d,NORTEAMERICA,Science & Tech,"Anthropic's 'do more with less' bet has kept it at the AI frontier, co-founder Amodei tells CNBC","Daniela Amodei and her brother, Dario Amodei, who is Anthropic's CEO, helped build the very worldview they're now betting against.",https://search.cnbc.com/rs/search/combinedcms/view.xml?partnerId=wrss01&id=100003114,https://www.cnbc.com/2026/01/03/anthropic-daniela-amodei-do-more-with-less-bet.html,78.98
776ecc9893e3328589cd3084fe34a365,NORTEAMERICA,Science & Tech,"Trump orders Chinese-controlled firm to unwind chip asset deal, citing national security risks",A Chinese-controlled company must divest semiconductor assets it bought from Emcore after the White House said the deal could threaten U.S. national security.,https://search.cnbc.com/rs/search/combinedcms/view.xml?partnerId=wrss01&id=100003114,https://www.cnbc.com/2026/01/03/trump-orders-unwind-chinese-chip-acquisition-emcore-hiefo-emcore-velocity-one-navgiation-gyro.html,78.98
5d6c12b9b9b198e7182014ababc73aac,NORTEAMERICA,Science & Tech,China’s ‘Silicon Valley’ is building robots and fortune-telling AI apps at the same time,Hangzhou’s AI ecosystem now spans everything from cutting-edge robotics to experimental apps built by solo founders.,https://search.cnbc.com/rs/search/combinedcms/view.xml?partnerId=wrss01&id=100003114,https://www.cnbc.com/2026/01/02/hangzhou-liangzhu-china-ai-physical-robots-startups-manycore-nvidia-unitree-deep-silicon-valley.html,81.4
8203b050c31c7711de54fa60e94e7b33,NORTEAMERICA,Science & Tech,Wellness trends worth taking into the new year (and some that aren't),"We reported on all sorts of products and practices promising to make you healthy last year. Here are the ones that stood up to science, and those that were mostly hype.",https://feeds.npr.org/1001/rss.xml,https://www.npr.org/2026/01/04/nx-s1-5665123/wellness-trends-new-year,72.68
a2335da9c803cf231ba98fa638aeaeb5,NORTEAMERICA,Science & Tech,‘You bet’ — why they just don’t trust sports anymore,"Over the last six months, I have had multiple people with a deep understanding of the sports world volunteer a truly dejected and disgusted version of the same complaint: “I Just don’t trust sports anymore.” Each complaint revolves around the explosion in gambling, which is not only tainting the greater sports world but also ensnaring&#8230;",https://thehill.com/feed/,https://thehill.com/opinion/finance/5669811-you-bet-why-they-just-dont-trust-sports-anymore/,73.4
115548d3892d0b47a4f1c0d4a9fcf0d4,NORTEAMERICA,Science & Tech,Starlink satellites to be moved to lower orbit,"SpaceX will be moving around 4,400 satellites to a lower orbit in 2026",https://thehill.com/feed/,https://thehill.com/policy/technology/5670067-spacex-starlink-satellites-lower-orbit/,77.99
2493f40680bf222ab98da78b9c1b5498,NORTEAMERICA,Science & Tech,Tesla falls behind China’s BYD as top EV maker after second year of declining sales,"China&#8217;s&#160;BYD overtook&#160;Elon Musk’s&#160;Tesla&#160;as the world’s&#160;leading&#160;electric vehicle&#160;(EV)&#160;seller in 2025, as&#160;Tesla&#160;faced declining sales for a second year in a row.&#160; BYD&#160;said Thursday that it&#160;sold about 2.26 million&#160;EVs&#160;in 2025, up&#160;nearly 28 percent&#160;from&#160;the year before. In a release&#160;Friday, Tesla said it delivered about 1.64 million EVs last year, down around&#160;9 percent from 2024.&#160; Musk’s EV ",https://thehill.com/feed/,https://thehill.com/policy/technology/5670030-byd-overtakes-tesla-ev-sales/,79.18
f6221fef0535a7c6799802a8b54925af,NORTEAMERICA,Science & Tech,"""Super flu"" surge: What to know about spiking flu cases and the surging ""Super K"" variant","The United States is seeing a massive surge in flu cases this winter, many of them attributed to the so-called ""super flu.""Why it matters: An unprecedented rise in flu cases comes as other sicknesses — such as the ""winter vomiting bug,"" COVID and whooping cough — are slamming the United States this winter.It also arrives as chaos has enveloped the Centers for Disease Control and Prevention, with many questions about vaccination schedules for children.Driving the news: Cases of the flu remain ele",https://www.axios.com/feeds/feed.rss,https://www.axios.com/2025/12/30/superflu-symptoms-2025-flu-h3n2,74.96
4e11b0ddcf49261128d18453ed2dc821,LATINOAMERICA,Science & Tech,"No, no puedes apagar la IA en apps como Gmail o WhatsApp (pero sí puedes ponerle límites)",Repasamos qué opciones hay para evitar que las aplicaciones más populares entrenen sus modelos de inteligencia artificial con tus datos,https://feeds.elpais.com/mrss-s/pages/ep/site/elpais.com/section/america/portada,https://elpais.com/tecnologia/2025-12-31/no-no-puedes-apagar-la-ia-en-apps-como-gmail-o-whatsapp-pero-si-puedes-ponerle-limites.html,76.58
