ID,Region,Category,Title,Description,Source,Link,Proximity_Score
2a43bc75b7bd147056a65a48f0cd868e,NORTEAMERICA,Science & Tech,"Some on-air claims about Dominion Voting Systems were false, Fox News acknowledges in statement after deal is announced",,http://rss.cnn.com/rss/cnn_topstories.rss,https://www.cnn.com/business/live-news/fox-news-dominion-trial-04-18-23/index.html,71.31
a2335da9c803cf231ba98fa638aeaeb5,NORTEAMERICA,Science & Tech,‘You bet’ — why they just don’t trust sports anymore,"Over the last six months, I have had multiple people with a deep understanding of the sports world volunteer a truly dejected and disgusted version of the same complaint: “I Just don’t trust sports anymore.” Each complaint revolves around the explosion in gambling, which is not only tainting the greater sports world but also ensnaring&#8230;",https://thehill.com/feed/,https://thehill.com/opinion/finance/5669811-you-bet-why-they-just-dont-trust-sports-anymore/,72.51
4534301e064888ddbc02de0b429965d7,NORTEAMERICA,Science & Tech,America forgets how deadly hepatitis B is. Taiwan offers lessons.,"Most Americans have never thought much about hepatitis B, and that's precisely because the vaccine works so well.",https://thehill.com/feed/,https://thehill.com/opinion/healthcare/5669968-hepatitis-b-vaccine-policy-change/,74.07
e7cf61084e20031b6b49f89e9fc317c9,NORTEAMERICA,Science & Tech,Tesla sales fall to lowest point since 2022,"Tesla vehicle sales declined for a second consecutive year in 2025, hitting their lowest point since 2022.The results mean that Chinese automaker BYD sold more EVs in 2025 than Tesla for the first time in a full year: 2.26 million for BYD vs. 1.64 million for Tesla.Why it matters: Tesla vehicle sales are critical to funding CEO Elon Musk's AI ambitions, including humanoid robots and self-driving cars.Driving the news: The company on Friday reported a 8.6% drop in deliveries — a close approximati",https://www.axios.com/feeds/feed.rss,https://www.axios.com/2026/01/02/tesla-sales-ev-elon-musk,75.92
4b0e0f55abc8af89ad6b789b764d3c17,NORTEAMERICA,Science & Tech,"AI in 2026: 'Show me the money""","The AI model maker race will continue in 2026, along with more agents and a growing pressure on companies to prove AI can pay off in the real world, experts tell Axios.Why it matters: AI may be both the current and next big thing, but success increasingly hinges less on being the ""best"" model and more on timing.The big picture: Rapid progress by OpenAI, Anthropic, Google and others drove frequent leapfrogging — and fierce price competition — in 2025. That dynamic is expected to intensify next ye",https://www.axios.com/feeds/feed.rss,https://www.axios.com/2026/01/01/ai-2026-money-openai-google-anthropic-agents,74.41
fab12db26acb718d997ac1fccc09882e,LATINOAMERICA,Science & Tech,Tomás Sánchez conjunta en sus pinturas paisajes y meditación,"El paisaje ha acompañado al pintor cubano Tomás Sánchez durante toda su vida. Desde su infancia ha dibujado la naturaleza que lo rodeaba. Su paso por escenas expresionistas ha estado también presente en su obra, marcada por su práctica de la meditación durante más de 55 años.",https://www.jornada.com.mx/rss/edicion.xml?v=1,https://www.jornada.com.mx/2026/01/04/cultura/a05n1cul?partner=rss,74.24
45f5835c5628b31d6ea5d8a47a9fbbf3,LATINOAMERICA,Science & Tech,"Entre ballenas, sangre y frío","Libros, cómics, una serie fenomenal y hasta el Nobel Krasznahorkai sirven para adentrarse en el territorio siempre fértil de Melville y el “¡por allí resopla!”",https://feeds.elpais.com/mrss-s/pages/ep/site/elpais.com/section/america/portada,https://elpais.com/cultura/2026-01-03/entre-ballenas-sangre-y-frio.html,75.16
107570447da9ec0d00e127d60464de50,EUROPA,Science & Tech,Swiss open criminal case against managers of ski resort bar after deadly fire,It comes after a preliminary investigation found the likely cause was sparklers on champagne bottles being carried too close to the ceiling.,http://feeds.bbci.co.uk/news/world/europe/rss.xml,https://www.bbc.com/news/articles/cjdjl303zxlo?at_medium=RSS&at_campaign=rss,86.03
6d7ebff4d5edd3131f668911e2a48aab,EUROPA,Science & Tech,Turkey detains 357 suspected IS members in nationwide raids,The arrests come just a day after three police officers were killed during a siege in the town of Yalova.,http://feeds.bbci.co.uk/news/world/europe/rss.xml,https://www.bbc.com/news/articles/c4g5gq19n9zo?at_medium=RSS&at_campaign=rss,77.26
9b2f4ceb9e1b21758f650723f048711c,EUROPA,Science & Tech,Swiss investigate bar Le Constellation managers,"Switzerland will hold a memorial mass this Sunday for the victims of the deadly New Year’s Eve fire at the Constellation bar, as investigators continue the painstaking process of identifying the remains, announcing they have so far formally identified 24 victims, including two 16-year-olds, while the bar’s two managers are under investigation for negligent manslaughter; France 24’s Olivia Bizot has been following developments from Crans-Montana and brings us this update.",https://www.france24.com/en/europe/rss,https://www.france24.com/en/video/20260104-swiss-investigate-bar-le-constellation-managers,85.69
e562512ff77f55f0afec98cbe7faaec9,EUROPA,Science & Tech,Crans-Montana fire: Swiss authorities launch probe into French bar managers,"Swiss authorities said on Saturday they had opened a criminal investigation into two French managers of a bar in a Swiss ski resort after a New Year’s Eve fire killed 40 revellers. The blaze, which broke out at a bar in Crans-Montana, injured 16 French nationals, while nine remain unaccounted for, according to an updated report released by the French Foreign Ministry.",https://www.france24.com/en/europe/rss,https://www.france24.com/en/live-news/20260103-crans-montana-fire-16-french-nationals-injured-nine-unaccounted-for,87.48
dcb742a6edf1b12a2ad3acd39227cc50,EUROPA,Science & Tech,"Crans-Montana: About 40 killed, 119 injured in fire","As Switzerland mourns, authorities are continuing to investigate the cause of the deadly fire and now believe it was triggered by sparklers placed on champagne bottles that came too close to the bar’s ceiling. Investigators are also examining whether the venue’s materials met fire safety regulations. Meanwhile, families anxiously await news of their loved ones, as some victims have been transferred to specialized burn units in hospitals in France and Italy, while six people remain unidentified. ",https://www.france24.com/en/europe/rss,https://www.france24.com/en/video/20260103-crans-montana-about-40-killed-119-injured-in-fire,87.4
18f104798677efed6be3401e62aa7be8,EUROPA,Science & Tech,Switzerland: Investigators examine nightclub fire origin sparkler link,"As Switzerland mourns, authorities are continuing to investigate the cause of the deadly fire and now believe it was triggered by sparklers placed on champagne bottles that came too close to the bar’s ceiling. Investigators are also examining whether the venue’s materials met fire safety regulations. Meanwhile, families anxiously await news of their loved ones, as some victims have been transferred to specialized burn units in hospitals in France and Italy, while six people remain unidentified. ",https://www.france24.com/en/europe/rss,https://www.france24.com/en/video/20260103-switzerland-investigators-examine-nightclub-fire-origin-sparkler-link,85.3
d511bf44e088d6769fadd838b91c4d98,EUROPA,Science & Tech,Crans-Montana fire likely caused by sparklers on Champagne bottles,"Initial investigations ​suggest that ⁠the fire which tore through a Swiss ski resort ​bar started ‍when 'fountain candles' attached ​to champagne bottles were carried ​aloft too close to the ceiling, the local prosecutor said on Friday. Authorities planned to look into whether the material on the ceiling that was designed to muffle sound conformed with regulations. FRANCE 24's Olivia Bizot is on the ground.",https://www.france24.com/en/europe/rss,https://www.france24.com/en/video/20260102-crans-montana-fire-likely-caused-by-sparklers-on-champagne-bottles,85.02
7814a5ae83455c66268f5d35364231d5,EUROPA,Science & Tech,"At least 40 killed and 119 injured in Crans-Montana fire caused by 'sparklers', Swiss officials say","Swiss officials told a press conference on Friday that the deadly fire at a Crans-Montana ski resort bar on New Year’s Eve, which killed at least 40 people, was likely caused by sparkling flares atop Champagne bottles that came too close to the ceiling. Authorities said 113 of the 119 injured have been identified, including 14 French and 11 Italians.",https://www.france24.com/en/europe/rss,https://www.france24.com/en/europe/20260102-watch-live-swiss-officials-brief-media-after-deadly-nye-fire-in-cras-montana-bar,87.4
aa4f1c2e4ee4785302d3e77313843b69,EUROPA,Science & Tech,Álbum | Las mejores imágenes del papa Francisco,Un repaso visual a la trayectoria de Jorge Mario Bergoglio. Desde sus días como cardenal de Buenos Aires hasta sus últimos meses como Papa en el Vaticano,https://rss.elconfidencial.com/mundo/,https://www.elconfidencial.com/mundo/2025-04-21/muere-papa-francisco-mejores-fotos_4066850/,73.93
c08d5f9d18d0b842f5c4e87fb73ef803,EUROPA,Science & Tech,Heathrow accused of ‘colossal failure’ over fire shutdown,Heathrow accused of ‘colossal failure’ over fire shutdown,https://www.telegraph.co.uk/news/rss.xml,https://www.telegraph.co.uk/news/2025/03/21/heathrow-airport-closed-latest-news-fire-power-outage/,79.23
dae5833f8229f43fb2d60353a02de77b,EUROPA,Science & Tech,Man in wheelchair stabbed to death in east London,,https://www.telegraph.co.uk/news/rss.xml,https://www.telegraph.co.uk/news/2024/08/28/man-in-wheelchair-stabbed-to-death-in-east-london/,71.28
95d2847f056619d9bd8d39591a687fee,EUROPA,Science & Tech,Man who called for migrant centres to be burnt down jailed for three years,,https://www.telegraph.co.uk/news/rss.xml,https://www.telegraph.co.uk/news/2024/08/09/riots-latest-news-protesters-stay-home/,75.16
3a8ee3a75893b6a6aed110a3167a70b5,EUROPA,Science & Tech,Swiss authorities open criminal investigation into ski bar after fire left 40 people dead,"The managers are suspected of negligent homicide, negligent bodily harm and causing fire by negligence, Swiss police said",https://www.independent.co.uk/news/world/europe/rss,https://www.independent.co.uk/news/world/europe/switzerland-fire-crans-montana-criminal-investigation-b2893972.html,85.59
7022193078235bc41cbec408011b1bf5,EUROPA,Science & Tech,"Incendie de Crans-Montana : 24 corps identifiés à ce stade, dont celui d’un Français de 39 ans",Plusieurs mineurs figurent parmi les personnes identifiées. Le Quai d’Orsay a précisé que 23 Français ont été blessés dans l’incendie du bar et que huit étaient toujours portés disparus.,https://www.lemonde.fr/rss/une.xml,https://www.lemonde.fr/international/article/2026/01/04/incendie-de-crans-montana-24-corps-identifies-a-ce-stade-dont-celui-d-un-francais-de-39-ans_6660511_3210.html,84.18
63006ce8f06015a7c83b30b7081ea560,EUROPA,Science & Tech,Criminal case opened against managers of Swiss bar after deadly fire,The blaze on New Year's Day at Le Constellation bar in Crans-Montana left at least 40 people dead.,https://www.politico.eu/feed/,https://www.politico.eu/article/criminal-case-opened-against-managers-swiss-bar-after-deadly-fire/?utm_source=RSS_Feed&utm_medium=RSS&utm_campaign=RSS_Syndication,87.4
71ae52369c2f8c93db5596acdfcbcb44,MEDIO_ORIENTE,Science & Tech,Boxer Anthony Joshua returns to UK after fatal Nigeria car crash,Joshua returns after recovering from the minor injuries he sustained during a crash that killed two of his friends.,https://www.aljazeera.com/xml/rss/all.xml,https://www.aljazeera.com/sports/2026/1/4/boxer-anthony-joshua-returns-to-uk-after-fatal-nigeria-car-crash?traffic_source=rss,76.76
f23b44010330330c822a238017d84be0,MEDIO_ORIENTE,Science & Tech,"Fire breaks out in Haruvit Forest, not yet contained",,https://www.jpost.com/rss/rssfeedsheadlines.aspx,https://www.jpost.com/breaking-news/article-856851,75.21
27b5c2bd4a1bafbca25c8fa6d071b941,MEDIO_ORIENTE,Science & Tech,"North Korea internet hit by a major outage, analyst says",,https://www.jpost.com/rss/rssfeedsheadlines.aspx,https://www.jpost.com/breaking-news/article-856837,75.49
e64dac2933b612893d047a9203c0bc68,ASIA_PACIFICO,Science & Tech,China to crack down on AI firms to protect kids,"The draft regulations are aimed to address concerns around chatbots, which have surged in popularity in recent months.",http://feeds.bbci.co.uk/news/world/asia/rss.xml,https://www.bbc.com/news/articles/c8dydlmenvro?at_medium=RSS&at_campaign=rss,78.55
5c4161313da64bcdee4e97e9b575bfe4,ASIA_PACIFICO,Science & Tech,"Jailed HK tycoon's 'teeth rotting and fingernails falling off', daughter tells BBC",The daughter of Jimmy Lai tells the BBC that her father's health is deteriorating in prison.,http://feeds.bbci.co.uk/news/world/asia/rss.xml,https://www.bbc.com/news/articles/cr57nvrjrlno?at_medium=RSS&at_campaign=rss,77.94
e6146bade3b706592b10456d083a3d7a,ASIA_PACIFICO,Science & Tech,Hong Kong records 72% jump in mainland Chinese tourists over long New Year break,"Hong Kong welcomed nearly 660,000 mainland Chinese visitors over the New Year countdown and the subsequent three-day holiday across the border, a 72 per cent increase from the same period a year ago.
Sector representatives said the surge was a boost for the hotel sector but brought limited benefits for retailers.
Data released by the Immigration Department on Sunday showed 659,090 mainland visitors entered Hong Kong between New Year’s Eve and Saturday, accounting for 79 per cent of the total...",https://www.scmp.com/rss/91/feed,https://www.scmp.com/news/hong-kong/hong-kong-economy/article/3338680/hong-kong-records-72-jump-mainland-chinese-tourists-over-long-new-year-break?utm_source=rss_feed,79.34
b3898b4adc6501113f2c25995a328566,ASIA_PACIFICO,Science & Tech,Passengers made 30 million trips in 2025 with Hong Kong’s high-speed rail line,"Passengers made more than 30 million trips using Hong Kong’s cross-border high-speed rail link last year, with the figure representing a 17 per cent increase from 2024 and setting a record.
The MTR Corporation also revealed on Sunday that the West Kowloon rail terminus set a new single-day ridership record on December 27, when the number of passenger trips reached about 140,000.
The company also described last year’s usage figure as a “record high”, while noting that cumulative patronage since..",https://www.scmp.com/rss/91/feed,https://www.scmp.com/news/hong-kong/transport/article/3338681/passengers-made-30-million-trips-2025-hong-kongs-high-speed-rail-line?utm_source=rss_feed,77.5
e153c5b5e8790f9203259f2afc92f6d7,ASIA_PACIFICO,Science & Tech,"2 bodies found as Indonesia extends search for missing Spanish father, 3 children","Indonesian rescuers recovered a second body on Sunday in the ongoing search for a Spanish soccer coach and two of his children who went missing after a tour boat sank during their Christmas holiday.
The rescue team retrieved the body floating near Padar island, about 2km (1.2 miles) from the site of the sinking, said Fathur Rahman, the Maumere Search and Rescue Office chief.
The newly recovered body remains unidentified by authorities, but is believed to be that of a member of the family who was",https://www.scmp.com/rss/91/feed,https://www.scmp.com/news/asia/southeast-asia/article/3338664/2-bodies-found-indonesia-extends-search-missing-spanish-father-3-children?utm_source=rss_feed,78.99
af2a35c02b1ccb7c270c34f5e3297ee5,ASIA_PACIFICO,Science & Tech,"Daiichi Sankyo to spend $1.9bn on production lines in China, US, elsewhere",,https://asia.nikkei.com/rss/feed/nar,https://asia.nikkei.com/business/pharmaceuticals/daiichi-sankyo-to-spend-1.9bn-on-production-lines-in-china-us-elsewhere,75.88
b0cbdaaf4cff46ffad208593fd992a44,ASIA_PACIFICO,Science & Tech,"Trump, Takaichi discuss PM's possible spring visit to US in phone call",,https://asia.nikkei.com/rss/feed/nar,https://asia.nikkei.com/politics/international-relations/trump-takaichi-discuss-pm-s-possible-spring-visit-to-us-in-phone-call,74.49
74826d9c8eb4ae780e0f68ff30ebe22b,ASIA_PACIFICO,Science & Tech,Japan's Takaichi to seek early 2026 Trump meeting as China tension persists,,https://asia.nikkei.com/rss/feed/nar,https://asia.nikkei.com/politics/international-relations/japan-china-tensions/japan-s-takaichi-to-seek-early-2026-trump-meeting-as-china-tension-persists,75.92
623ef60b872789a37798a99838fa81aa,ASIA_PACIFICO,Science & Tech,"From Rolexes to iPhones, 'used in Japan' gains global cachet",,https://asia.nikkei.com/rss/feed/nar,https://asia.nikkei.com/spotlight/datawatch/from-rolexes-to-iphones-used-in-japan-gains-global-cachet,73.81
c08dcc3f11edc9661db3787d091f3076,ASIA_PACIFICO,Science & Tech,Japan's Meiko plans circuit board plant in Vietnam for Samsung AI phones,,https://asia.nikkei.com/rss/feed/nar,https://asia.nikkei.com/business/electronics/japan-s-meiko-plans-circuit-board-plant-in-vietnam-for-samsung-ai-phones,76.14
eae39224091d6d238402c072ffb454e7,ASIA_PACIFICO,Science & Tech,Why China is racing to develop its own commercial jet engine,China's reliance on Western jet engines remains a key vulnerability.,https://www.straitstimes.com/news/asia/rss.xml,https://www.straitstimes.com/asia/east-asia/sovereignty-in-the-skies-why-china-is-racing-to-develop-its-own-commercial-jet-engine,74.75
5aa4e3224de96ee790b4a0d6675b5edf,ASIA_PACIFICO,Science & Tech,"Stuck in Afghanistan, Pakistanis want border to finally reopen",The border has remained largely closed since the October clashes that killed more than 70 people.,https://www.straitstimes.com/news/asia/rss.xml,https://www.straitstimes.com/asia/south-asia/stuck-in-afghanistan-pakistanis-want-border-to-finally-reopen,77.9
3ecf38ac21fb190867ea65d8c9b45fa8,ASIA_PACIFICO,Science & Tech,Concerned about well-being of the people of Venezuela: India,The MEA further informed that the Embassy of India in capital Caracas “is in contact with members of the Indian community and will continue to provide all possible assistance”,https://www.thehindu.com/news/national/feeder/default.rss,https://www.thehindu.com/news/national/recent-developments-in-venezuela-a-matter-of-deep-concern-mea/article70470314.ece,74.77
31589513c11a43b811135e2426ef05ba,AFRICA,Science & Tech,Dozens missing after boat carrying 200 migrants sinks off Gambia,It is the latest accident on one of the world’s most dangerous routes used by West Africans trying to reach Spain.,http://feeds.bbci.co.uk/news/world/africa/rss.xml,https://www.bbc.com/news/articles/clynvkwglx4o?at_medium=RSS&at_campaign=rss,79.13
bffa583faa72a8baf70788084a9a65bc,AFRICA,Science & Tech,Equatorial Guinea pair banned for abusing referee at Afcon,Equatorial Guinea's Carlos Akapo and Josete Miranda are banned for four games for abusing the referee after their defeat by Sudan at Afcon 2025.,http://feeds.bbci.co.uk/news/world/africa/rss.xml,https://www.bbc.com/sport/football/articles/c98p566m3jdo?at_medium=RSS&at_campaign=rss,76.1
9d8ea5b321533889eaff7c8bed49f331,AFRICA,Science & Tech,An alleged drug cartel and a murdered witness: South Africa's police corruption probe,Allegations of graft and political interference in the police have been aired at public hearings.,http://feeds.bbci.co.uk/news/world/africa/rss.xml,https://www.bbc.com/news/articles/cj69d8we98jo?at_medium=RSS&at_campaign=rss,76.6
244fa87f2bb9427ea3912d0302286775,AFRICA,Science & Tech,Somalia: Armed Forces Kill 20 Al-Shabaab Fighters in Targeted Raid,"[Shabelle] Mogadishu -- Somali special forces, Danab, carried out a targeted operation Friday night in Bulo Fulay, a key Al-Shabaab stronghold in the Bay region, killing 20 members of the militant group, officials said.",https://allafrica.com/tools/headlines/rdf/latest/headlines.rdf,https://allafrica.com/stories/202601030129.html,77.9
a17d574bd23cfb8ff2b0d5d20cd450d4,AFRICA,Science & Tech,"Kenya: Multi storey building collapses in Nairobi, trapping unknown number of people","Kenya woke up to another construction disaster after a multi storey building collapsed in Nairobi's South C area, trapping an unknown number of people.",https://www.africanews.com/feed/,http://www.africanews.com/2026/01/02/kenya-multi-storey-building-collapses-in-nairobi-trapping-unknown-number-of-people/,78.87
096d25162922de826d035b327bdfa125,NORTEAMERICA,Politics & Policy,Dominion still has pending lawsuits against election deniers such as Rudy Giuliani and Sidney Powell,,http://rss.cnn.com/rss/cnn_topstories.rss,https://www.cnn.com/business/live-news/fox-news-dominion-trial-04-18-23/h_8d51e3ae2714edaa0dace837305d03b8,73.29
8d8cb6bc715658ccd2c2ab9afc2b36e2,NORTEAMERICA,Politics & Policy,Democrats bash Justice Clarence Thomas but their plan to investigate ethics allegations is unclear,"Senate Democrats railed against Justice Clarence Thomas on Tuesday amid reports that the Supreme Court conservative failed to disclose luxury travel, gifts and a real estate transaction involving a GOP megadonor, but their plan to investigate the conservative jurist remains unclear.",http://rss.cnn.com/rss/cnn_topstories.rss,https://www.cnn.com/2023/04/18/politics/clarence-thomas-ethics-democrats/index.html,72.67
159d0a4b374118cf0b3d3397321b2587,NORTEAMERICA,Politics & Policy,GOP prepared to block vote to replace Feinstein on Senate Judiciary,"Senate Majority Leader Chuck Schumer said on Tuesday that he hopes to replace Democratic Sen. Dianne Feinstein on the Senate Judiciary Committee with Sen. Ben Cardin of Maryland and aims to set up a floor vote on the issue this afternoon, which Republicans are expected to block.",http://rss.cnn.com/rss/cnn_topstories.rss,https://www.cnn.com/2023/04/18/politics/schumer-senate-feinstein-vote-cardin/index.html,73.98
39be7ed3422bc16085ea055b5d39f3c9,NORTEAMERICA,Politics & Policy,The 2024 presidential alternative many voters will want,,http://rss.cnn.com/rss/cnn_topstories.rss,https://www.cnn.com/2023/04/18/opinions/2024-presidential-election-alternative-voters-lieberman,74.92
ed48a4dc8231a0771784aa0e42b1838b,NORTEAMERICA,Politics & Policy,"Venezuelan leader Maduro, wife arrive at Brooklyn detention facility after capture by US forces",Venezuelan leader Nicolás Maduro and his wife arrived at the Metropolitan Detention Center in New York Saturday night and face drug conspiracy charges after being captured by U.S. forces Saturday.,http://feeds.foxnews.com/foxnews/latest,https://www.foxnews.com/us/venezuelan-leader-maduro-lands-new-york-after-being-captured-us-forces-drug-conspiracy-charges,86.08
d4f6dc8d6db65628f008f3d26da1907b,NORTEAMERICA,Politics & Policy,Maduro arrives in New York. What to know about the U.S. operation in Venezuela,"President Trump said the U.S. would ""run"" Venezuela, following the capture of President Nicolás Maduro on Saturday. But many questions remain about what's next.",https://feeds.npr.org/1001/rss.xml,https://www.npr.org/2026/01/03/nx-s1-5665670/venezuela-strikes-us-maduro,87.06
542f80a12519ac5ea69ad36d5bfaa437,NORTEAMERICA,Politics & Policy,Live Updates: Questions Mount for U.S. and Venezuela After Maduro’s Capture,"The Trump administration faced scrutiny over its plans for Venezuela after seizing President Nicolás Maduro and bringing him to New York to face drug trafficking charges. President Trump said the United States would “run the country,” but there were few indications of how.",https://rss.nytimes.com/services/xml/rss/nyt/World.xml,https://www.nytimes.com/live/2026/01/04/world/trump-us-venezuela-maduro,88.36
a18e92e5e3d61895f49786099e15f6ca,NORTEAMERICA,Politics & Policy,"Inside ‘Operation Absolute Resolve,’ the U.S. Effort to Capture Maduro","The tactically precise operation successfully extracted Mr. Maduro with no loss of American life, a result heralded by President Trump amid larger questions about the legality and rationale for the U.S. actions in Venezuela.",https://rss.nytimes.com/services/xml/rss/nyt/World.xml,https://www.nytimes.com/2026/01/03/us/politics/trump-capture-maduro-venezuela.html,86.32
70ccc95af5d1da3647c394a2dd425a63,NORTEAMERICA,Politics & Policy,"Trump Avoids Congressional Approval for Maduro’s Capture, and Democrats Raise Alarms","Democrats raised constitutional concerns and said the Trump administration had misrepresented its goals in Venezuela, while most Republicans cheered the action.",https://rss.nytimes.com/services/xml/rss/nyt/World.xml,https://www.nytimes.com/2026/01/03/us/politics/trump-venezuela-congress-authorization.html,85.52
f33a8b544550f3a49561d36670a8d26e,NORTEAMERICA,Politics & Policy,"Live updates: Trump operation against Maduro draws praise, fury","President Trump&#8217;s operation to oust Venezuelan President Nicolás Maduro on Saturday drew a sharp response in the U.S. and abroad, from outright praise to fury, with some expressing gladness over the end of a dictator&#8217;s regime tempered by concern over how it was handled. The massive covert operation, in the works since late summer, followed&#8230;",https://thehill.com/feed/,https://thehill.com/homenews/administration/5671431-live-updates-trump-venezuela-maduro/,87.73
ad503ad1f664b65055bee154cd8f6cd1,NORTEAMERICA,Politics & Policy,Pelosi accuses Trump of hypocrisy over Maduro charges,"Former House Speaker Nancy Pelosi (D-Calif.) on Saturday called President Trump&#8217;s indictment of Venezuelan President Nicolas Maduro &#8220;hypocritical,&#8221; after Trump pardoned former Honduran President Juan Orlando Hernández last year following his conviction on drug charges. &#8220;If the President grounds his actions on the basis of drug trafficking charges, it is entirely hypocritical in light of&#8230;",https://thehill.com/feed/,https://thehill.com/homenews/house/5671135-pelosi-trump-venezuela-maduro-charges/,83.64
