ID,Region,Category,Title,Description,Source,Link,Proximity_Score
c4a914eb657801ec1107e629e1909bde,NORTEAMERICA,War & Conflict,Trump tried to bury evidence of the Jan. 6 riot. NPR's archive preserves the facts,"NPR's Jan. 6 archive brings together reporting, video, documents and testimony to show what really happened during the Capitol riot. Explore the timeline, cases and evidence behind the attack.",https://feeds.npr.org/1001/rss.xml,https://www.npr.org/2026/01/04/g-s1-102891/jan-6-archive,76.39
84cbada13c76b3e539a2f2e9e658e70e,NORTEAMERICA,War & Conflict,Ukrainian Politics Has Reawakened. Zelensky Must Tread Carefully.,The Ukrainian leader is reshuffling his cabinet as a corruption scandal reshapes the political landscape at a pivotal point in peace negotiations.,https://rss.nytimes.com/services/xml/rss/nyt/World.xml,https://www.nytimes.com/2026/01/04/world/europe/ukraine-politics-cabinet-zelensky.html,80.79
c366773e39b16effb54c27b5a7b06616,NORTEAMERICA,War & Conflict,"China’s Russian Town Has Log Cabins and Cyrillic Signs, but No Russians","Enhe was once home to thousands of ethnic Russians. Under Xi Jinping’s push for ethnic unity, little remains beyond nostalgia and props for tourists.",https://rss.nytimes.com/services/xml/rss/nyt/World.xml,https://www.nytimes.com/2026/01/04/world/asia/china-russia-xi-putin.html,74.96
92c0f2e1657066320ef75e4791440489,NORTEAMERICA,War & Conflict,"Trump Shares Photo of Captured Nicolás Maduro, Blindfolded and Handcuffed","The Venezuelan president and his wife were flown out of Caracas by helicopter to the U.S.S. Iwo Jima, a warship taking them to New York.",https://rss.nytimes.com/services/xml/rss/nyt/World.xml,https://www.nytimes.com/2026/01/03/world/americas/maduro-photo-trump.html,83.69
e6436150b2ce9a930af9af7c55648956,NORTEAMERICA,War & Conflict,C.I.A. Source Inside Venezuelan Government Helped Track Maduro,The spy agency also used stealth drones to monitor the whereabouts of the Venezuelan leader.,https://rss.nytimes.com/services/xml/rss/nyt/World.xml,https://www.nytimes.com/2026/01/03/world/americas/cia-venezuela-maduro.html,82.05
8280294b23cc7f75a30ba23d16b4f98f,NORTEAMERICA,War & Conflict,Maduro capture adds to Hegseth’s combative first year at the Pentagon,"Surprise U.S. strikes on Venezuela and the capture of that country’s president, Nicolás Maduro, are putting the crescendo on a combative first year at the Pentagon for Secretary Pete Hegseth. Hegseth, who with President Trump rechristened the Department of Defense as the Department of War, has sought to restore a “warrior ethos” to the military,&#8230;",https://thehill.com/feed/,https://thehill.com/policy/defense/5671429-pentagon-hegseth-venezuela-maduro-capture/,83.9
d5941ce500e62ae4d2ccc9ad347a43db,NORTEAMERICA,War & Conflict,Texas leaders react to Venezuela airstrikes and Maduro’s capture,United States elected officials reacted to the early morning airstrike and capture of Venezuelan President Nicolás Maduro Saturday.,https://thehill.com/feed/,https://thehill.com/homenews/nexstar_media_wire/5671628-texas-leaders-react-venezuela-operation/,83.55
0f825add48d7b35f47b58181f368f201,NORTEAMERICA,War & Conflict,Trump coins ‘Don-roe Doctrine’ as he explains Venezuela operation,"President Trump on Saturday said the operation in Venezuela, which culminated with strikes on the capital and the capture of Venezuelan President Nicolás Maduro, were part of what he coined the &#8220;Don-roe Doctrine.&#8221; Trump said under Maduro, Venezuela hosted &#8220;foreign adversaries in our region and acquiring menacing offensive weapons that could threaten U.S. interests and&#8230;",https://thehill.com/feed/,https://thehill.com/homenews/administration/5671516-trump-donroe-doctrine-venezuela/,84.03
fe3af7dd02da6423b7ad817c52a28844,NORTEAMERICA,War & Conflict,Massie questions legality of Trump’s action in Venezuela,"Rep. Thomas Massie (R-Ky.) on Saturday questioned the legality of the Trump administration&#8217;s strikes on Venezuela, which ended with the capture of Venezuelan President Nicolas Maduro and his wife Cilia Flores. &#8220;If this action were constitutionally sound, the Attorney General wouldn’t be tweeting that they’ve arrested the President of a sovereign country and his wife&#8230;",https://thehill.com/feed/,https://thehill.com/homenews/house/5671052-trump-venezuela-strikes-questioned/,82.78
0f35383dec1f677d75a3b7915d97b5a4,NORTEAMERICA,War & Conflict,Senate to vote next week to block Trump’s military action against Venezuela,The Senate will vote next week on a bipartisan war powers resolution to block President Trump from continuing military action against Venezuela — a vote that takes on heightened importance after U.S. forces attacked the South American nation and arrested President Nicolás Maduro early Saturday. The resolution to block the administration from engaging in further&#8230;,https://thehill.com/feed/,https://thehill.com/homenews/senate/5671074-senate-war-powers-resolution-venezuela-vote/,84.24
ae19a79ca027079d8cb5974c63c04c38,NORTEAMERICA,War & Conflict,Trump’s Venezuela operation polarizes world leaders,"President Trump’s shocking operation capturing Venezuelan President Nicolas Maduro and his wife polarized the international community on Saturday. Exiled opposition figures welcomed the overthrow of a dictator, while authoritarians cried foul and democratic leaders fretted over the precedent. In Latin America, Trump’s critics condemned the U.S. military operation as a call back to American interventionism&#8230;",https://thehill.com/feed/,https://thehill.com/policy/international/5671034-world-reaction-trump-venezuela-maduro/,85.36
c0f4717283a39caae1b9f0b39a41141a,NORTEAMERICA,War & Conflict,Kaine: Trump conducted ‘unauthorized’ military attack on Venezuela,"Sen. Tim Kaine (D-Va.), the ranking member of the Senate Foreign Relations Subcommittee on the Western Hemisphere, on Saturday said the military attack on Venezuela and the arrest of its leader, Nicolás Maduro, was “unauthorized” and called on Congress to reassert its authority. “President Trump’s unauthorized military attack on Venezuela to arrest Maduro—however terrible he&#8230;",https://thehill.com/feed/,https://thehill.com/homenews/senate/5671027-trump-venezuela-strike-congress-tim-kaine/,84.24
1a3396f0f5b0ee8b69e38294e4d37a08,NORTEAMERICA,War & Conflict,The Red Apple: Mamdani pledges to introduce ‘the Warmth of Collectivism’,"Mitterrand promised the same magical economic results. The French economy collapsed, and socialist policies had to be rolled back.",https://thehill.com/feed/,https://thehill.com/opinion/campaign/5670467-marxian-manhattan-mamdani-pledges-to-introduce-the-warmth-of-collectivism/,73.85
46c84c4d3f813cab1a2d3cead86b8ae5,NORTEAMERICA,War & Conflict,"Trump describes capture of Maduro on Fox News; says 2 US troops, helicopter hit","President Trump provided the first details of the U.S. operation to capture Venezuelan President Nicholas Maduro during a Saturday morning interview on Fox News, also confirming that two American personnel and a helicopter were hit during the overnight raid. “I think we had nobody killed, I have to say because a couple of guys were&#8230;",https://thehill.com/feed/,https://thehill.com/homenews/administration/5670943-trump-venezuela-maduro-capture/,84.48
f4259c144904f2a2e3ba81ca194460b8,NORTEAMERICA,War & Conflict,Venezuelan VP presses Trump admin for ‘proof of life’ after Maduro captured,"Venezuelan Vice President Delcy Rodriguez on Saturday demanded that the Trump administration give &#8220;proof of life&#8221; after U.S. personnel captured President Nicolas Maduro and his wife Cilia Flores hours earlier. &#8220;In the face of this brutal attack we at this moment do not know the place in which the President Nicolás Maduro is, along with&#8230;",https://thehill.com/feed/,https://thehill.com/policy/international/5670877-venezuela-delcy-rodriguez-nicolas-maduro-capture-trump-us/,83.28
e3dc11b17eb678006a11219d8e06c7e0,NORTEAMERICA,War & Conflict,"Russia harshly criticizes US attack on Venezuela, capture of Maduro","Russia is offering stark criticism of the U.S. military attack on Venezuela, which resulted in the capture of President Nicolas Maduro. In response, Russia called for a full meeting of the United Nations Security Council. &#8220;This morning, the United States carried out an act of armed aggression against Venezuela. This causes deep concern and condemnation,&#8221;&#8230;",https://thehill.com/feed/,https://thehill.com/policy/international/5670812-russia-calls-un-venezuela-security/,86.02
fb42736990701e7844a361a59de0f4b4,NORTEAMERICA,War & Conflict,Trump’s Iran threat angers ‘America First’ wing; Tehran hawks question tactics,"President Trump is seizing on protests in Iran to threaten U.S. military intervention against the Islamic regime, angering leaders of the GOP’s “America First” wing, which has been increasingly critical of the Republican administration’s interventionist foreign policy.&#160; The president’s threats come as Israel lobbies for American support to strike what it says are renewed efforts&#8230;",https://thehill.com/feed/,https://thehill.com/policy/international/5670327-trump-iran-intervention-threat-response/,82.39
1801076fbb638a3ef9763412db314ecf,NORTEAMERICA,War & Conflict,"Trump blocks chipmaker merger, citing national security risk","President Trump signed an executive order Friday blocking a semiconductor deal between HieFo Corp. and Emcore Corp., citing national security concerns related to China.  “There is credible evidence that leads me to believe that HieFo Corporation, a company organized under the laws of Delaware (HieFo) and controlled by a citizen of the People&#8217;s Republic of&#8230;",https://thehill.com/feed/,https://thehill.com/homenews/administration/5670409-hiefo-emcore-china-national-security/,77.41
9c2232b9badf3de12cb23880539cbb93,NORTEAMERICA,War & Conflict,Top Democrat calls on Trump to expand oil tanker seizures to target Russia,"Sen. Chris Coons (D-Del.) on Friday called on President Trump to expand the administration&#8217;s seizures of Venezuelan oil tankers to tankers coming from Russia. &#8220;He’s been using our military to interdict oil tankers because there is this ghost fleet that helps keep Venezuela’s regime alive,&#8221; Coons told Jonathan Lemire of &#8220;Morning Joe&#8221; on MS NOW.&#8230;",https://thehill.com/feed/,https://thehill.com/homenews/senate/5670231-coons-urges-trump-action-russia-tankers/,81.24
35e25b8959f3578a04628fc439285695,NORTEAMERICA,War & Conflict,Grenell says ‘Wicked’ composer’s Kennedy Center cancellation ‘totally bogus’,"Kennedy Center interim President Richard Grenell dismissed reports Friday that &#8220;Wicked&#8221; composer Stephen Schwartz canceled his upcoming performances at the venue, saying he had never signed a deal to perform under the new leadership. &#8220;The Stephen Schwartz reports are totally bogus,&#8221; Grenell wrote on the social platform X. &#8220;Shame on the woke high school reporters&#8230;",https://thehill.com/feed/,https://thehill.com/blogs/in-the-know/5670083-grenell-says-wicked-composers-kennedy-center-cancelation-totally-bogus/,73.37
a559b3c5f925d819137e696ffcee0ce0,NORTEAMERICA,War & Conflict,Greene: Trump threatening troops in Iran ‘everything we voted against in ’24’,"Outgoing Rep. Marjorie Taylor Greene (R-Ga.) on Friday slammed President Trump’s threat to intervene in Iran as it cracks down on anti-government protests.&#160; Greene said on the social platform X that Trump’s pledge, along with Israeli billionaire Shlomo Kramer telling CNBC that the federal government should “limit the First Amendment” by cracking down on speech&#8230;",https://thehill.com/feed/,https://thehill.com/homenews/house/5670172-greene-trump-iran-protests/,81.65
698f264a2446eea0ce9858c752ff4e71,NORTEAMERICA,War & Conflict,Mamdani revokes Adams executive orders supporting Israel,"Newly inaugurated New York City Mayor Zohran Mamdani (D) has revoked a series of executive orders issued by former Mayor Eric Adams (D), including some aimed at supporting Israel.&#160; In one of Mamdani’s first moves as mayor, he issued a directive to undo orders signed by Adams since Sept. 26, 2024, the day Adams was&#8230;",https://thehill.com/feed/,https://thehill.com/homenews/state-watch/5670136-mamdani-revokes-israel-orders/,77.78
00ab04834effdcbb94b66c19dc3bca83,NORTEAMERICA,War & Conflict,Trump signals more Latin American invasions could be next after capturing Maduro,"Hours after the U.S. invaded Venezuela to seize President Nicolás Maduro, President Trump sent a warning to the governments of Mexico, Cuba and Colombia that their countries could be next.Why it matters: The stunning attack on Caracas follows Trump's recent assertion of his own version of the Monroe Doctrine, and the president's comments that the U.S is not afraid to put ""boots on the ground"" in the country suggest that the administration won't hesitate to have an ongoing presence in the region.",https://www.axios.com/feeds/feed.rss,https://www.axios.com/2026/01/03/trump-maduro-venezuela-mexico-sheinbaum,84.38
5f5441082b0f79588e135da1437f937f,NORTEAMERICA,War & Conflict,6 reasons why the U.S. went after Maduro,"The United States' astonishing overnight raid to capture Venezuelan President Nicolás Maduro followed an intense months-long pressure campaign, jumpstarted by a $50 million bounty put on Maduro's head in August.Why it matters: Publicly, the U.S. justified its boat strikes and massive military presence off the coast of Venezuela in the name of fighting narcoterrorism.Privately, White House officials long saw the removal of Maduro as a key aim, Axios' Marc Caputo reported.Between the lines: The Tr",https://www.axios.com/feeds/feed.rss,https://www.axios.com/2026/01/03/maduro-capture-reasons-us-venezuela,82.73
02124064afa05d6f1f428389b33aef47,NORTEAMERICA,War & Conflict,Trump threatens military force if Iran kills protesters,"President Trump warned that the U.S. could intervene militarily if the Iranian regime kills civilians that have been protesting against it over the last several days. Why it matters: His threat — the first official U.S. statement on the issue — could give backwind to the protesters and deter Iran from using force against them. At the same time it could also be used by Tehran to claim the protests are fueled by Iran's external enemies.Driving the news: ""If Iran shots and violently kills peaceful ",https://www.axios.com/feeds/feed.rss,https://www.axios.com/2026/01/02/trump-iran-threat-protesters,83.69
920ca992cd3a3d8c89e7bd6925bfac5e,NORTEAMERICA,War & Conflict,"Maduro ""ready"" to talk with U.S. on drug trafficking, won't comment on dock strike","Venezuela's leader Nicolás Maduro said U.S. and Venezuelan officials should ""start talking seriously"" on drug trafficking and oil, per an interview published Thursday.The big picture: Maduro acknowledged during the interview the months-long U.S. militarized pressure campaign targeting suspected ""narco-terrorists"" and was asked directly about President Trump's comments that the U.S. military had ""knocked out"" a dock that Venezuelan drug boats allegedly used.What they're saying: ""If they want to t",https://www.axios.com/feeds/feed.rss,https://www.axios.com/2026/01/02/venezuela-maduro-talks-us-trump-drug-trafficking-interview,83.74
0941cd228cacb313d2822a69ef572477,NORTEAMERICA,War & Conflict,How Trump's agenda lands at the Supreme Court in 2026,"The Supreme Court has many pivotal cases lined up for the coming year, many revolving around President Trump's policies.The big picture: Trump has relied heavily on the court's emergency docket during his second term, using it to block lower court rulings while cases play out.SCOTUS granted Trump several wins in 2025, including letting him fire federal workers, proceed with his mass deportation plan, and ban transgender people from military service. Here are the Supreme Court cases to watch in 2",https://www.axios.com/feeds/feed.rss,https://www.axios.com/2026/01/01/2026-trump-supreme-court-cases-tariffs,75.64
9805a5296698e82df2287b12d6b8db49,NORTEAMERICA,War & Conflict,"Netanyahu raised possible ""round 2"" strikes on Iran with Trump","Israeli Prime Minister Benjamin Netanyahu discussed the possibility of attacking Iran again in 2026 during his meeting with President Trump on Monday, according to a U.S. official and two additional U.S. sources familiar with the details of the meeting.Why it matters: Another war with Iran could further destabilize a region that's seeking stability after two years of crises.Trump and Netanyahu both saw the 12-day war with Iran in June as a tremendous success. But Netanyahu has argued more strike",https://www.axios.com/feeds/feed.rss,https://www.axios.com/2025/12/31/netanyahu-trump-iran-strikes-2026,81.71
d52808a504ffcb1777a629cb105809bd,NORTEAMERICA,War & Conflict,Big events are back — on TV and IRL,"Data: Nielsen; Note: The Tony Awards were not held in 2020 and the Golden Globes did not air in 2022; Chart: Erin Davis/Axios VisualsMajor live TV events saw a notable ratings uptick this year, underscoring how much audiences are craving communal, real-time experiences as their day-to-day viewing habits become more fragmented. Why it matters: The pandemic shift to streaming drove historic low TV ratings for live events that have mostly started to rebound, but only a few have managed to set new r",https://www.axios.com/feeds/feed.rss,https://www.axios.com/2025/12/31/super-bowl-thanksgiving-day-parade-emmys-oscars,70.99
28f36ba70cd22f42399b8270569bd5b0,NORTEAMERICA,War & Conflict,Racist AI content is spreading fast — and swaying political opinions,"One video shows multiple Black women screaming and pounding on a door with the caption ""store under attack."" Another captures distraught Walmart employees of color being loaded into an ICE van. Why it matters: These AI-generated viral videos aren't just perpetuating racism —  they're influencing political discourse.The big picture: Creating a fake AI-generated video is easy. Come up with a prompt of what you want to see (it can even include typos) and apps like OpenAI's Sora and Google's VEO 3 c",https://www.axios.com/feeds/feed.rss,https://www.axios.com/2025/12/27/racist-ai-videos-viral-trend,76.74
746237065647c1cbcd5131019aa6fe7b,NORTEAMERICA,War & Conflict,Trump's Cabinet of main characters,"Several members of President Trump's national security team have taken on unusually large public profiles — with frequent on-camera appearances, dramatic pronouncements and even eyebrow-raising wardrobe choices.Why it matters: It's no secret that Trump prefers his appointees to appear straight out of ""central casting."" But in national security roles, showmanship can quickly become a liability.FBI Director Kash Patel, for example, has seized the spotlight far more than his predecessors — often fo",https://www.axios.com/feeds/feed.rss,https://www.axios.com/2025/12/27/trump-cabinet-patel-hegseth-noem-cosplay,77.65
8f87a82653836270e5efb505bc26b8de,NORTEAMERICA,War & Conflict,"Netanyahu's Mar-a-Lago visit ""crucial"" for future of Gaza deal","President Trump plans several big announcements on Gaza in early January, but the next steps hinge on his meeting on Monday at Mar-a-Lago with Israeli Prime Minister Benjamin Netanyahu.Why it matters: White House officials think Netanyahu is slow-walking the peace process, and fear he will resume the war with Hamas. But while the Israeli prime minister is butting heads with Trump's team, he hopes to bring the president himself over to his more hawkish point of view, a senior Israeli official sai",https://www.axios.com/feeds/feed.rss,https://www.axios.com/2025/12/26/trump-netanyahu-meeting-gaza-mar-a-lago,81.65
f18d9c9e3fdffb0493ecb0489b9adb37,NORTEAMERICA,War & Conflict,What Pope Leo said in his first Christmas message,"Pope Leo XIV, in his Christmas message, called for an end to global wars, highlighted humanitarian crises and pleaded for sympathy for immigrants worldwide.Why it matters: The Christmas Day message was a call for peace and the first for the U.S.-born Pope, who was elected in May. He cited suffering in Gaza, Ukraine, Yemen, Africa, Haiti, Myanmar, Thailand, Cambodia and more.The big picture: Leo has often clashed with the Trump administration with his messages on embracing immigrants seeking a ne",https://www.axios.com/feeds/feed.rss,https://www.axios.com/2025/12/25/pope-leo-christmas-message-vatican,79.61
b82cd17b48b90aa7ecd334dc57f98270,NORTEAMERICA,War & Conflict,Supreme Court denies Trump's push to deploy National Guard in Chicago,"The Supreme Court declined Tuesday to let President Trump send National Guard troops to the Chicago area.Why it matters: The 6-3 ruling in the conservative-majority high court leaves in place a lower court order temporarily barring Trump from deploying the National Guard to Illinois.It marks a significant setback for the president's immigration policies in the face of opposition from Democratic-run cities and states.Zoom in: ""At this preliminary stage, the government has failed to identify a sou",https://www.axios.com/feeds/feed.rss,https://www.axios.com/2025/12/24/supreme-court-trump-national-guard-chicago-blocked,75.32
47cbe02f45839b99e916043ce44b6bd7,LATINOAMERICA,War & Conflict,Key points of the military attack on Venezuela: Early morning bombings and a ‘captured’ president,"Trump ordered a ‘large-scale strike,’ while Caracas has declared a state of emergency",https://feeds.elpais.com/mrss-s/pages/ep/site/elpais.com/section/america/portada,https://english.elpais.com/international/2026-01-03/key-points-of-the-military-attack-on-venezuela-early-morning-bombings-and-a-captured-president.html,86.35
4e3641a334ce49f9b793ed394555c976,LATINOAMERICA,War & Conflict,"Delta Force, the elite US military unit that captured Maduro","The group also participated in the pursuit of Iraqi dictator Saddam Hussein, drug trafficker Pablo Escobar, and Panamanian dictator Manuel Noriega",https://feeds.elpais.com/mrss-s/pages/ep/site/elpais.com/section/america/portada,https://english.elpais.com/usa/2026-01-03/delta-force-the-elite-us-military-unit-that-captured-maduro.html,79.78
0894614be799a8fe0cc285d80ba6c6c3,EUROPA,War & Conflict,"Missile attack on Kharkiv kills two including child, authorities say","Russian officials say reports of the missile strike are untrue, suggesting the explosion was caused by Ukrainian ammunition.",http://feeds.bbci.co.uk/news/world/europe/rss.xml,https://www.bbc.com/news/articles/cx2lnk3486xo?at_medium=RSS&at_campaign=rss,79.45
c3ad2cc953bf10af5557557ee6523f44,EUROPA,War & Conflict,Ukraine denies drone attack on Putin's residence,"Russia has accused Ukraine of targeting a presidential residence, which President Zelensky called ""typical Russian lies"".",http://feeds.bbci.co.uk/news/world/europe/rss.xml,https://www.bbc.com/news/articles/c4g4g5lgngvo?at_medium=RSS&at_campaign=rss,80.5
afbe62fc72b5d9b667974808a8fc2d43,EUROPA,War & Conflict,Zelensky names spy chief to head presidential office after corruption row,"Kyrylo Budanov has led the Hur military intelligence, which has claimed a number of highly-effective strikes against Russia.",http://feeds.bbci.co.uk/news/world/europe/rss.xml,https://www.bbc.com/news/articles/cx2k0101enyo?at_medium=RSS&at_campaign=rss,81.98
b4834ae203cf01798083551b6a824d25,EUROPA,War & Conflict,Russia accuses Ukraine of killing 27 people in New Year attack in occupied Kherson region,Ukraine says it only conducts strikes against military targets and adheres to international law.,http://feeds.bbci.co.uk/news/world/europe/rss.xml,https://www.bbc.com/news/articles/cew81lpqvzeo?at_medium=RSS&at_campaign=rss,81.74
5daf5aeca5816aceb9548e212cd5b7ec,EUROPA,War & Conflict,Zelensky says Russia 'doesn't want peace' ahead of meeting Trump in Florida,The pair are expected to discuss territorial concessions and security guarantees during the negotiations.,http://feeds.bbci.co.uk/news/world/europe/rss.xml,https://www.bbc.com/news/articles/c1dzvpg1341o?at_medium=RSS&at_campaign=rss,81.64
c2148404f12473fc8fb6879aca6f73c3,EUROPA,War & Conflict,The 'thorny' issues that threaten to derail a Russia-Ukraine peace deal,"Two of the main sticking points involve territory and the fate of Europe's biggest nuclear plant, which is currently occupied by Russia.",http://feeds.bbci.co.uk/news/world/europe/rss.xml,https://www.bbc.com/news/articles/c78v5dj3x39o?at_medium=RSS&at_campaign=rss,78.42
9ca5f0de3fc4f0ad9cc6bdc5c95a783d,EUROPA,War & Conflict,Russia's losses in Ukraine rise faster than ever as US pushes for peace deal,A steep rise in soldiers' obituaries is documented by the BBC as part of its work in counting Russian war losses.,http://feeds.bbci.co.uk/news/world/europe/rss.xml,https://www.bbc.com/news/articles/c62n922dnw7o?at_medium=RSS&at_campaign=rss,80.06
fd8d1cea4e00e8aff1fdb29e0136f747,EUROPA,War & Conflict,Trump and Zelensky appear more upbeat - but show little evidence that peace is near for Ukraine,"Although both leaders express optimism in Florida there is no indication of progress, writes the BBC's Vitaliy Shevchenko.",http://feeds.bbci.co.uk/news/world/europe/rss.xml,https://www.bbc.com/news/articles/c17x7lnd1r7o?at_medium=RSS&at_campaign=rss,81.72
41efb278a9879462bda3cdcc0b0ceb1f,EUROPA,War & Conflict,Should a top Russian archaeologist face trial for digging in occupied Crimea?,The case of a scholar wanted in Ukraine sparked a debate on the relationship between museums and the Russian state.,http://feeds.bbci.co.uk/news/world/europe/rss.xml,https://www.bbc.com/news/articles/c623rvzjjd2o?at_medium=RSS&at_campaign=rss,77.36
